Oda Sicil No,Ticari Sicil No,Şirket Türü,Mahalle Adı,İlçe Adı,Meslek Grubu Numarası,Meslek Grubu Adı,Ünvanı,Tescilli Adresi
2295162,245074,LİMİTED,ATATÜRK,URLA,49,GAYRİMENKUL FAALİYETLERİ GRUBU,SARDUNYA EMLAK LİMİTED ŞİRKETİ,ATATÜRK MAH. ÇEŞME URLA İZMİR ASFALTI CAD. NO: 118 URLA / İZMİR
1974931,211478,ANONİM,AKDENİZ,KONAK,49,GAYRİMENKUL FAALİYETLERİ GRUBU,SARI İLANLAR BİLGİ TEKNOLOJİLERİ PAZARLAMA VE DIŞ TİCARET ANONİM ŞİRKETİ,AKDENİZ MAH. ŞEHİT FETHİBEY CAD. HERİS TOWER NO: 55 İÇ KAPI NO: 091 KONAK / İZMİR
2299174,249095,LİMİTED,DEMİRKÖPRÜ,KARŞIYAKA,49,GAYRİMENKUL FAALİYETLERİ GRUBU,SARIYAR GAYRİMENKUL DANIŞMANLIĞI YAPI İNŞAAT SANAYİ VE TİCARET LİMİTED ŞİRKETİ,DEMİRKÖPRÜ MAH. CAHER DUDAYEV BUL. NO: 219A KARŞIYAKA / İZMİR
1178521,655,LİMİTED,ARDIÇ,ÇEŞME,49,GAYRİMENKUL FAALİYETLERİ GRUBU,SATURN GAYRİMENKUL YATIRIM DANIŞMANLIĞI LİMİTED ŞİRKETİ,ARDIÇ MAH. 5492 SK. NO: 3 ÇEŞME / İZMİR
2028861,216912,ANONİM,ADALET,BAYRAKLI,49,GAYRİMENKUL FAALİYETLERİ GRUBU,SEAK GAYRİMENKUL DEĞERLEME ANONİM ŞİRKETİ İZMİR ŞUBESİ,ADALET MAHALLESİ ANADOLU CAD. MEGAPOL TOWER BLOK NO: 41 İÇ KAPI NO: 091 BAYRAKLI / İZMİR
2103261,224380,LİMİTED,ALAYBEY,KARŞIYAKA,49,GAYRİMENKUL FAALİYETLERİ GRUBU,SEDAT HAYTE EKSPERTİZ HİZMETLERİ LİMİTED ŞİRKETİ ,ALAYBEY MAHALLESİ 1691 SK. 12 SİTESİ AZİZE BLOK NO: 12 İÇ KAPI NO: 4 KARŞIYAKA / İZMİR
2272171,241398,LİMİTED,NERGİZ,KARŞIYAKA,49,GAYRİMENKUL FAALİYETLERİ GRUBU,SEFKAN GAYRİMENKUL DANIŞMANLIĞI OTOMOTİV İNŞAAT TURİZM SANAYİ VE  TİCARET LİMİTED ŞİRKETİ,NERGİZ MAHALLESİ ALİ ALP BÖKE CADDESİ ÇINAR BLOK NO: 23C KARŞIYAKA / İZMİR
2169451,231028,LİMİTED,ULUCAK CUMHURİYET,KEMALPAŞA,49,GAYRİMENKUL FAALİYETLERİ GRUBU,SEGA TREYLER SANAYİ TİCARET LİMİTED ŞİRKETİ,ULUCAK CUMHURİYET MAH. ADNAN MENDERES BUL. NO: 59 İÇ KAPI NO: 1 KEMALPAŞA / İZMİR
2290781,243271,LİMİTED,KONAK,KONAK,49,GAYRİMENKUL FAALİYETLERİ GRUBU,SELECT YATÇILIK İNŞAAT EMLAK VE TİCARET LİMİTED ŞİRKETİ,KONAK MAHALLESİ MÜCİBUR RAHMAN SOKAK SALİHAĞA İŞHANI BLOK NO: 3 İÇ KAPI NO: 509 KONAK / İZMİR
2296420,246279,LİMİTED,ATIFBEY,GAZİEMİR,49,GAYRİMENKUL FAALİYETLERİ GRUBU,SELİN AYDIN GAYRİMENKUL YATIRIMLARI TİCARET LİMİTED ŞİRKETİ,ATIFBEY MAH. 67 SK. NO: 33 İÇ KAPI NO: 32 GAZİEMİR / İZMİR
2303372,253311,LİMİTED,KAZIMDİRİK,BORNOVA,49,GAYRİMENKUL FAALİYETLERİ GRUBU,SEMA ÖZCAN DANIŞMANLIK İNŞAAT VE MİMARLIK İTHALAT İHRACAT SANAYİ VE TİCARET LİMİTED ŞİRKETİ,KAZIMDİRİK MAH. 375 SK. NO: 11/1 İÇ KAPI NO: 4 BORNOVA / İZMİR
2027411,216761,LİMİTED,DALYAN,ÇEŞME,49,GAYRİMENKUL FAALİYETLERİ GRUBU,SEMİH AVCI EMLAK İNŞAAT GIDA OTOMOTİV TURİZM VE TİCARET  PAZARLAMA LİMİTED ŞİRKETİ,DALYAN MAHALLESİ 4000 SOKAK NO: 71 C ÇEŞME / İZMİR
2235581,237699,LİMİTED,AKSOY,KARŞIYAKA,49,GAYRİMENKUL FAALİYETLERİ GRUBU,SENKA EMLAK DANISMANLIK İNSAAT TAAHHÜT İÇ VE DIS TICARET LİMİTED ŞİRKETİ,AKSOY MAHALLESİ FAZIL BEY CADDESİ NO: 96B KARŞIYAKA / İZMİR
2178881,231981,ANONİM,MİMAR SİNAN,KONAK,49,GAYRİMENKUL FAALİYETLERİ GRUBU,SERAMİKSAN TAŞINMAZ ANONİM ŞİRKETİ ,MİMAR SİNAN MAHALLESİ 1401 SOKAK PLATİN BLOK NO: 2B İÇ KAPI NO: 2B KONAK / İZMİR
2295879,245791,ANONİM,ADALET,BAYRAKLI,49,GAYRİMENKUL FAALİYETLERİ GRUBU,SERİN YATIRIM DANIŞMANLIĞI İNŞAAT TARIM SANAYİ TİCARET ANONİM ŞİRKETİ,ADALET MAH. MANAS BUL. NO: 39 İÇ KAPI NO: 3201 BAYRAKLI / İZMİR
1859651,199846,LİMİTED,SEKİZ EYLÜL,KEMALPAŞA,49,GAYRİMENKUL FAALİYETLERİ GRUBU,SERKAN BİLGİLİ EMLAK DANIŞMANLIK LİMİTED ŞİRKETİ,SEKİZ EYLÜL MAHALLESİ İZMİR CAD. NO: 98/1 KEMALPAŞA/İZMİR
2236881,237827,LİMİTED,MANSUROĞLU,BAYRAKLI,49,GAYRİMENKUL FAALİYETLERİ GRUBU,SERPRO GAYRİMENKUL LİMİTED ŞİRKETİ,MANSUROĞLU MAH. 288/6 SK. HASAN EFENDİ NO: 2/1 İÇ KAPI NO: 3 BAYRAKLI / İZMİR
502131,69009,LİMİTED,M.ALİ AKMAN,KONAK,49,GAYRİMENKUL FAALİYETLERİ GRUBU,SERSAN MÜHENDİSLİK EMLAK SANAYİ VE TİCARET LİMİTED ŞİRKETİ,M.ALİ AKMAN MAHALLESİ 20/2 SOK. NO:1/1 KONAK / İZMİR
2303942,253886,LİMİTED,ÇINAR,BORNOVA,49,GAYRİMENKUL FAALİYETLERİ GRUBU,SERVICE WAY TESİS YÖNETİM HİZMETLERİ LİMİTED ŞİRKETİ,ÇINAR MAH. 5003/2 SK. NO: 8 İÇ KAPI NO: 1 BORNOVA / İZMİR
1980441,212031,ANONİM,KAZIMDİRİK,BORNOVA,49,GAYRİMENKUL FAALİYETLERİ GRUBU,SEY GAYRİMENKUL DANIŞMANLIK ANONİM ŞİRKETİ,KAZIMDİRİK MAHALLESİ 284 SK. NO: 2/1 İÇ KAPI NO: 67 BORNOVA / İZMİR
1616681,175561,ANONİM,KORUTÜRK,BALÇOVA,49,GAYRİMENKUL FAALİYETLERİ GRUBU,SEYİT ALİ BÜYÜKBAŞ İÇ VE DIŞ TİCARET ANONİM ŞİRKETİ,KORUTÜRK MAHALLESİ MİTHATPAŞA CAD. YORGANCIOĞLU APART. SİT. NO: 255/10 BALÇOVA/İZMİR
2282691,242461,LİMİTED,ULAMIŞ,SEFERİHİSAR,49,GAYRİMENKUL FAALİYETLERİ GRUBU,SEZEN TURİZM VE TAŞIMACILIK TİCARET LİMİTED ŞİRKETİ 2 ŞUBESİ,ULAMIŞ MAH. ÇEŞME CAD. NO: 17/1 SEFERİHİSAR / İZMİR
1047081,116454,LİMİTED,MEHMET ALİ AKMAN,KONAK,49,GAYRİMENKUL FAALİYETLERİ GRUBU,SİNAN BEZİRCİLİOĞLU İNŞAAT SANAYİ VE GAYRİMENKUL DANIŞMANLIĞI TİCARET LİMİTED ŞİRKETİ,MEHMET ALİ AKMAN MAHALLESİ 4/10 SOKAK NO:1/1 KONAK / İZMİR
2268061,240981,LİMİTED,AKDENİZ,KONAK,49,GAYRİMENKUL FAALİYETLERİ GRUBU,SİRENA GAYRİMENKUL EMLAK İNŞAAT VE DANIŞMANLIK HİZMETLERİ  LİMİTED ŞİRKETİ,AKDENİZ MAHALLESİ GAZİ OSMAN PAŞA BLV. NO:10/A ORTAÇ APT BLOK Semt Seçiniz KONAK / İZMİR
2295891,245810,ANONİM,YENİKENT,URLA,49,GAYRİMENKUL FAALİYETLERİ GRUBU,SİRİUS PLAN GAYRİMENKUL İNŞAAT TURİZM OTOMOTİV SANAYİ VE TİCARET ANONİM ŞİRKETİ,YENİKENT MAH. MUSTAFA ERTEKİN CAD. NO: 8A URLA / İZMİR
2103441,224406,LİMİTED,CUMHURİYET,KARŞIYAKA,49,GAYRİMENKUL FAALİYETLERİ GRUBU,SİSTEM TAŞINMAZ DEĞERLEME VE İNŞAAT TİCARET LİMİTED ŞİRKETİ ,CUMHURİYET MAHALLESİ 1595 SK. KAP PASAJI BLOK NO: 223 CUMHURİYET KARŞIYAKA / İZMİR
1885121,202433,ANONİM,MANSUROĞLU,BAYRAKLI,49,GAYRİMENKUL FAALİYETLERİ GRUBU,SİSTEM TEK GAYRİMENKUL DANIŞMANLIĞI ALIM SATIM VE KOMİSYONCULUĞU HİZMETLERİ TİCARET ANONİM ŞİRKETİ,MANSUROĞLU MAHALLESİ 1593/1 SOK. NO:2/32 A BLOK APT. BAYRAKLI / İZMİR
1131281,126066,LİMİTED,İSKELE,KARABURUN,49,GAYRİMENKUL FAALİYETLERİ GRUBU,SİZİN EMLAK TURİZM İNŞAAT MADENCİLİK SANAYİ VE TİCARET LİMİTED ŞİRKETİ,İSKELE MAHALLESİ DEĞİRMEN SK. NO:21/1 KARABURUN / İZMİR
2233451,237480,LİMİTED,İSMET İNÖNÜ,ÇEŞME,49,GAYRİMENKUL FAALİYETLERİ GRUBU,SKY ÇEŞME GAYRİMENKUL DANIŞMANLIK TİCARET LİMİTED ŞİRKETİ,İSMET İNÖNÜ MAH. 2084 SK. NO: 15 İÇ KAPI NO: 6 ÇEŞME / İZMİR
2159541,230030,LİMİTED,BAHRİYE ÜÇOK,KARŞIYAKA,49,GAYRİMENKUL FAALİYETLERİ GRUBU,SLOGAN TEKSTİL PAZARLAMA İTHALAT İHRACAT SANAYİ VE TİCARET LİMİTED  ŞİRKETİ,BAHRİYE ÜÇOK MAHALLESİ RÜŞTÜ ŞARDAĞ CADDESİ NO:71/A BURAK BLOK KARŞIYAKA / İZMİR
2087341,222779,ANONİM,İSMET KAPTAN,KONAK,49,GAYRİMENKUL FAALİYETLERİ GRUBU,SMART KURUMSAL GAYRİMENKUL DEĞERLEME VE DANIŞMANLIK ANONİM ŞİRKETİ İZMİR ŞUBESİ,İSMET KAPTAN MAH. 1373 SK. SUAT MANİSALI IŞ HANI BLOK NO: 8 İÇ KAPI NO: 53 KONAK / İZMİR
2300712,250641,LİMİTED,İMBATLI,KARŞIYAKA,49,GAYRİMENKUL FAALİYETLERİ GRUBU,SMYRNA GAYRİMENKUL VE DANIŞMANLIK TİCARET LİMİTED ŞİRKETİ,İMBATLI MAH. 1825 SK. NO: 10 İÇ KAPI NO: 103 KARŞIYAKA / İZMİR
2255221,239678,LİMİTED,KÜLTÜR,KONAK,49,GAYRİMENKUL FAALİYETLERİ GRUBU,SMYRNA INVEST EMLAK GAYRİMENKUL DANIŞMANLIĞI LİMİTED ŞİRKETİ,KÜLTÜR MAH. DR. MUSTAFA ENVER BEY CAD. AYŞE APT BLOK NO: 16 İÇ KAPI NO: 3 KONAK / İZMİR
2302266,252200,LİMİTED,YALI,KARŞIYAKA,49,GAYRİMENKUL FAALİYETLERİ GRUBU,SOİL GAYRİMENKUL DANIŞMANLIK TİCARET LİMİTED ŞİRKETİ,YALI MAH. 6436/2 SK. KAPTAN NO: 2 İÇ KAPI NO: 8 KARŞIYAKA / İZMİR
2186741,232790,LİMİTED,YALI,GÜZELBAHÇE,49,GAYRİMENKUL FAALİYETLERİ GRUBU,SOLD EMLAK TURİZM İNŞAAT GAYRİMENKUL DANIŞMANLIĞI SANAYİ TİCARET LİMİTED ŞİRKETİ,YALI MAH. 230 SK. NO: 2 İÇ KAPI NO: 1 GÜZELBAHÇE / İZMİR
615621,77705,LİMİTED,İSMET KAPTAN,KONAK,49,GAYRİMENKUL FAALİYETLERİ GRUBU,SOLEA GAYRİMENKUL VE DANIŞMANLIK HİZMETLERİ İNŞAAT SANAYİ TİCARET  LİMİTED ŞİRKETİ,İSMET KAPTAN MAHALLESİ ŞAİR EŞREF BLV. MONTRÖ IŞ MERKEZI Apt. NO: 35 /1/61 KONAK / İZMİR
2110011,225067,LİMİTED,ÇETİN EMEÇ,BALÇOVA,49,GAYRİMENKUL FAALİYETLERİ GRUBU,SOLMAZ EMLAK VE GAYRİMENKUL DANIŞMANLIĞI LİMİTED ŞİRKETİ ,ÇETİN EMEÇ MAHALLESİ NO:5 SELVİ SK. MELEK BLOK İÇ KAPI NO: 2 BALÇOVA / İZMİR
2302647,252583,LİMİTED,MANSUROĞLU,BAYRAKLI,49,GAYRİMENKUL FAALİYETLERİ GRUBU,SOLOMON JAKUP GAYRİMENKUL PAZARLAMA LİMİTED ŞİRKETİ,MANSUROĞLU MAH. 286/3 SK. NO: 14B BAYRAKLI / İZMİR
2299700,249624,LİMİTED,MİTHATPAŞA,KONAK,49,GAYRİMENKUL FAALİYETLERİ GRUBU,SOLOTİM GAYRİMENKUL İNŞAAT ORGANİZASYON DANIŞMANLIK OTOMOTİV TİCARET VE LİMİTED ŞİRKETİ,MİTHATPAŞA MAH. MİTHATPAŞA CAD. PALMİYE NO: 560A KONAK / İZMİR
2244481,238604,LİMİTED,MİMARSİNAN,KONAK,49,GAYRİMENKUL FAALİYETLERİ GRUBU,SONAY GAYRİMENKUL YATIRIM İNŞAAT SANAYİ VE TİCARET LİMİTED ŞİRKETİ ,MİMARSİNAN MAHALLESİ 1420 SK. NO:64/C İÇ KAPI NO: 64C MURAT BLOK KONAK / İZMİR
2188041,232914,LİMİTED,ALAÇATI,ÇEŞME,49,GAYRİMENKUL FAALİYETLERİ GRUBU,SONER VARHAN GAYRİMENKUL LİMİTED ŞİRKETİ ,ALAÇATI MAHALLESİ 12047 NO:20/A ÇEŞME / İZMİR
2144761,228548,LİMİTED,GÜVEN,BUCA,49,GAYRİMENKUL FAALİYETLERİ GRUBU,SONKAT GAYRİMENKUL İNŞAAT SANAYİ VE TİCARET LİMİTED ŞİRKETİ ,GÜVEN MAHALLESİ 382 SK. NO: 3B İÇ KAPI NO: B BUCA / İZMİR
2045561,218575,ANONİM,ADATEPE,BUCA,49,GAYRİMENKUL FAALİYETLERİ GRUBU,SONSUZ YATIRIM DANIŞMANLIĞI ANONİM ŞİRKETİ,ADATEPE MAHALLESİ 24 SK. NO: 9 B BUCA/İZMİR
2301502,251432,LİMİTED,BOSTANLI,KARŞIYAKA,49,GAYRİMENKUL FAALİYETLERİ GRUBU,SÖZ SEVGİ ÖKSÜZ GAYRİMENKUL DANIŞMANLIĞI LİMİTED ŞİRKETİ,BOSTANLI MAH. CENGİZ TOPEL CAD. FERAH NO: 15 İÇ KAPI NO: 1 KARŞIYAKA / İZMİR
2231301,237272,LİMİTED,YALI,KARŞIYAKA,49,GAYRİMENKUL FAALİYETLERİ GRUBU,SPİCA GAYRİMENKUL DANIŞMANLIK ALIM SATIM TİCARET LİMİTED ŞİRKETİ,YALI MAH. AHMET KEMAL BAYSAK BUL. NO: 9F KARŞIYAKA / İZMİR
2298374,248276,LİMİTED,ADALET,BAYRAKLI,49,GAYRİMENKUL FAALİYETLERİ GRUBU,SQUAREMETERS REAL ESTATE GAYRİMENKUL YATIRIM DANIŞMANLIĞI SANAYİ VE TİCARET LİMİTED ŞİRKETİ,ADALET MAH. MANAS BUL. NO: 39 İÇ KAPI NO: 2511 BAYRAKLI / İZMİR
2286761,242869,LİMİTED,AKDENİZ,KONAK,49,GAYRİMENKUL FAALİYETLERİ GRUBU,SRK EMLAK GAYRİMENKUL ALIM SATIM LİMİTED ŞİRKETİ,AKDENİZ MAHALLESİ CUMHURİYET BULVARI NO:120 KONAK / İZMİR
2103401,224405,ANONİM,MALTEPE,GÜZELBAHÇE,49,GAYRİMENKUL FAALİYETLERİ GRUBU,ST SİTE YÖNETİMİ İNŞAAT SANAYİ VE TİCARET ANONİM ŞİRKETİ,MALTEPE MAH. 50 SK. NO: 1 İÇ KAPI NO: 1 GÜZELBAHÇE / İZMİR
2302472,252412,ANONİM,KAZIMDİRİK,BORNOVA,49,GAYRİMENKUL FAALİYETLERİ GRUBU,STAR 35 GAYRİMENKUL YATIRIM İNŞAAT TİCARET ANONİM ŞİRKETİ,KAZIMDİRİK MAH. 367/6 SK. MULTİ TÜRK KIRKİKİ YATIRIM NO: 3 BORNOVA / İZMİR
2017621,215783,ANONİM,YENİ MAHALLE,ÇİĞLİ,49,GAYRİMENKUL FAALİYETLERİ GRUBU,STARTKEY GAYRİMENKUL EĞİTİM VE DANIŞMANLIK SANAYİ TİCARET ANONİM ŞİRKETİ,YENİ MAHALLE MAH. ESKİ HAVAALANI CAD. B5 NO: 108LD ÇİĞLİ / İZMİR
2287151,242916,LİMİTED,ÇINARLI,KONAK,49,GAYRİMENKUL FAALİYETLERİ GRUBU,STG GAYRİMENKUL LİMİTED ŞİRKETİ,ÇINARLI MAH. OZAN ABAY CAD. EGEPERLA NO: 8 İÇ KAPI NO: Z17 KONAK / İZMİR
675511,81398,LİMİTED,KASIMPAŞA,MENDERES,49,GAYRİMENKUL FAALİYETLERİ GRUBU,STUNCE İÇ VE DIŞ TİCARET LİMİTED ŞİRKETİ,KASIMPAŞA MAH. 227 SK. NO: 7A MENDERES / İZMİR
1103311,122994,LİMİTED,YAYLACIK,BUCA,49,GAYRİMENKUL FAALİYETLERİ GRUBU,SU PINARIM GIDA PAZARLAMA VE DAĞITIM TİCARET LİMİTED ŞİRKETİ ,YAYLACIK MAHALLESİ GAZİ OSMANPAŞA CADDESİ NO: 232B BUCA / İZMİR
1867401,200639,LİMİTED,SASALI MERKEZ,ÇİĞLİ,49,GAYRİMENKUL FAALİYETLERİ GRUBU,SU VE ATEŞ DANIŞMANLIK GAYRİMENKUL SANAYİ VE TİCARET LİMİTED ŞİRKETİ,SASALI MERKEZ MAHALLESİ 10 SK. NO: 40/_ ÇİĞLİ/İZMİR
2235461,237674,LİMİTED,MUSTAFA KEMAL,BUCA,49,GAYRİMENKUL FAALİYETLERİ GRUBU,SUAT YÜCE YAPI İNŞAAT GAYRİMENKUL DANIŞMANLIĞI SANAYİ TİCARET LİMİTED ŞİRKETİ BUCA ŞUBESİ,MUSTAFA KEMAL MAHALLESİ GAZETECİ YAZAR İSMAİL SİVRİ BULVARI NO: 329B BUCA BUCA / İZMİR
1375581,150493,LİMİTED,HACI İSA,URLA,49,GAYRİMENKUL FAALİYETLERİ GRUBU,SUAY MÜZİK FİLM ORGANİZASYON MENEJERLİK TURİZM İNŞAAT BALIKÇILIK TEMİZLİK SANAYİ VE TİCARET LİMİTED ŞİRKETİ,HACI İSA MAHALLESİ NECATİ CUMALI CAD. NO: 12 İÇ KAPI NO: 4 URLA / İZMİR
2107101,224768,ANONİM,ÇINARLI,KONAK,49,GAYRİMENKUL FAALİYETLERİ GRUBU,SUDURU GAYRİMENKUL SANAYİ VE TİCARET ANONİM ŞİRKETİ ,ÇINARLI MAHALLESİ 1572 SOKAK NO:33 KONAK / İZMİR
2056771,219714,ANONİM,ATATÜRK,URLA,49,GAYRİMENKUL FAALİYETLERİ GRUBU,SUN REAL ESTATE GAYRİMENKUL DANIŞMANLIK TİCARET ANONİM ŞİRKETİ,ATATÜRK MAH. ÇEŞME URLA İZMİR ASFALTI CAD. NO: 118 URLA / İZMİR
1977681,211749,LİMİTED,AKDENİZ,KONAK,49,GAYRİMENKUL FAALİYETLERİ GRUBU,SUNMARİS MERMER İTHALAT İHRACAT SANAYİ TİCARET LİMİTED ŞİRKETİ,AKDENİZ MAHALLESİ GAZİ OSMAN PAŞA BLV. NO: 2 B/105 KONAK/İZMİR
1795331,193332,ANONİM,TURABİYE,SEFERİHİSAR,49,GAYRİMENKUL FAALİYETLERİ GRUBU,SÜMER GAYRİMENKUL DEĞERLEME VE DANIŞMANLIK ANONİM ŞİRKETİ İZMİR ŞUBESİ,TURABİYE MAH. 20 SK. NO: 20 İÇ KAPI NO: 7 SEFERİHİSAR / İZMİR
2093851,223430,LİMİTED,AKIN SİMAV,KONAK,49,GAYRİMENKUL FAALİYETLERİ GRUBU,ŞAHİN GROUP İNŞAAT SANAYİ VE TİCARET LİMİTED ŞİRKETİ ,AKIN SİMAV MAHALLESİ MİTHATPAŞA CADDESİ GONCA BLOK NO: 381A İÇ KAPI NO: A KONAK / İZMİR
2304548,254495,LİMİTED,SOĞUKPINAR,KEMALPAŞA,49,GAYRİMENKUL FAALİYETLERİ GRUBU,ŞAHİN GROUP YAPI GAYRİMENKUL TİCARET LİMİTED ŞİRKETİ,SOĞUKPINAR MAH. 296 SK. NO: 14A KEMALPAŞA / İZMİR
2206951,234815,LİMİTED,ATATÜRK,URLA,49,GAYRİMENKUL FAALİYETLERİ GRUBU,ŞAHİN35 GAYRİMENKUL SANAYİ VE TİCARET LİMİTED ŞİRKETİ,ATATÜRK MAH. NEYZEN TEVFİK CAD. NO: 425A URLA / İZMİR
1813621,195209,LİMİTED,KAZIMDİRİK,BORNOVA,49,GAYRİMENKUL FAALİYETLERİ GRUBU,ŞAHOĞLU YAPI SANAYİ VE TİCARET LİMİTED ŞİRKETİ,KAZIMDİRİK MAH. MUSTAFA KEMAL CAD. NO: 21 İÇ KAPI NO: 4 BORNOVA / İZMİR
2195931,233708,LİMİTED,HIDIRLIK,SEFERİHİSAR,49,GAYRİMENKUL FAALİYETLERİ GRUBU,ŞAKİR OGÜN TARHAN GAYRİMENKUL İNŞAAT TURİZM SANAYİ VE TİCARET LİMİTED ŞİRKETİ,HIDIRLIK MAH. İNÖNÜ CAD. A-BLOK NO: 1 SEFERİHİSAR / İZMİR
2038571,217862,ANONİM,KAZIMDİRİK,BORNOVA,49,GAYRİMENKUL FAALİYETLERİ GRUBU,ŞENKAYA GAYRİMENKUL ANONİM ŞİRKETİ,KAZIMDİRİK MAH. 369/2 SK. NO: 1 İÇ KAPI NO: 144 BORNOVA / İZMİR
1750291,188796,ANONİM,EMREZ,GAZİEMİR,49,GAYRİMENKUL FAALİYETLERİ GRUBU,ŞİFNE GAYRİMENKUL İNŞAAT VE TURİZM SANAYİ VE TİCARET ANONİM ŞİRKETİ ,EMREZ MAHALLESİ AKÇAY CADDESİ NO:64/2 POSTAKODU:35410 GAZİEMİR / İZMİR
2088571,222900,LİMİTED,ÇUKURALTI,MENDERES,49,GAYRİMENKUL FAALİYETLERİ GRUBU,TAHİR ERTOK GAYRİMENKUL YATIRIM DANIŞMANLIĞI SANAYİ TİCARET LİMİTED ŞİRKETİ,ÇUKURALTI MAHALLESİ MUSTAFA KEMAL PAŞA BLV. NO:244/A MENDERES / İZMİR
1871731,201076,ANONİM,MENDERES,BUCA,49,GAYRİMENKUL FAALİYETLERİ GRUBU,TAHTALI İNŞAAT ÖZEL EĞİTİM ÖĞRETİM OTOMOTİV PETROL GIDA TURİZM SANAYİ VE TİCARET ANONİM ŞİRKETİ BUCA REZİDANS SUİT HOME ŞUBESİ,MENDERES MAHALLESİ 120 SK. NO: 4/1 BUCA/İZMİR
2142511,228335,LİMİTED,ŞEMİKLER,KARŞIYAKA,49,GAYRİMENKUL FAALİYETLERİ GRUBU,TAKS GAYRİMENKUL DEĞERLEME SANAYİ VE TİCARET LİMİTED ŞİRKETİ ,ŞEMİKLER MAHALLESİ 6280 SK. NO: 25 İÇ KAPI NO: 4 KARŞIYAKA / İZMİR
2105211,224572,ANONİM,AKDENİZ,KONAK,49,GAYRİMENKUL FAALİYETLERİ GRUBU,TAKSİM KURUMSAL GAYRİMENKUL DEĞERLEME VE DANIŞMANLIK ANONİM  ŞİRKETİ İZMİR ŞUBESİ,AKDENİZ MAHALLESİ ŞEHİT FETHİBEY CADDESİ HERİS TOWER BLOK NO: 55 İÇ KAPI NO: 091 KONAK / İZMİR
2147931,228867,ANONİM,MANSUROĞLU,BAYRAKLI,49,GAYRİMENKUL FAALİYETLERİ GRUBU,TALYA GAYRİMENKUL DEĞERLEME VE DANIŞMANLIK ANONİM ŞİRKETİ İZMİR ŞUBESİ,MANSUROĞLU MAH. 288 SK. NO: 31 İÇ KAPI NO: 8 BAYRAKLI / İZMİR
2295876,245790,ANONİM,ADALET,BAYRAKLI,49,GAYRİMENKUL FAALİYETLERİ GRUBU,TANAY YATIRIM DANIŞMANLIĞI İNŞAAT TARIM SANAYİ TİCARET ANONİM ŞİRKETİ,ADALET MAH. MANAS BUL. NO: 39 İÇ KAPI NO: 3201 BAYRAKLI / İZMİR
739141,77637,LİMİTED,YALI,GÜZELBAHÇE,49,GAYRİMENKUL FAALİYETLERİ GRUBU,"TANIŞ EMLAK KOMİSYONCULUĞU, REKLAMCILIK VE İNŞAAT SANAYİ TİCARET LİMİTED ŞİRKETİ",YALI MAHALLESİ NO:1/3 GÜZELBAHÇE / İZMİR
1694961,183393,ANONİM,R.ŞEVKET İNCE,BAYRAKLI,49,GAYRİMENKUL FAALİYETLERİ GRUBU,TANKAR GAYRİMENKUL YATIRIM ANONİM ŞİRKETİ ,R.ŞEVKET İNCE MAHALLESİ 2148/9 SK. NO:4 BAYRAKLI / İZMİR
1745141,188258,ANONİM,CENNETOĞLU,KARABAĞLAR,49,GAYRİMENKUL FAALİYETLERİ GRUBU,TANKAR YAPI YATIRIM ANONİM ŞİRKETİ ,CENNETOĞLU MAHALLESİ YEŞİLLİK CAD. NO:238 KARABAĞLAR / İZMİR
2302303,252242,LİMİTED,VATAN,KARABAĞLAR,49,GAYRİMENKUL FAALİYETLERİ GRUBU,TAREM GAYRİMENKUL VE DANIŞMANLIK HİZMETLERİ SANAYİ VE TİCARET LİMİTED ŞİRKETİ,VATAN MAH. 9109 SK. OYAL NO: 10A İÇ KAPI NO: A KARABAĞLAR / İZMİR
2302267,252202,ANONİM,ALSANCAK,KONAK,49,GAYRİMENKUL FAALİYETLERİ GRUBU,TARSOS GAYRİMENKUL YATIRIM TİCARET ANONİM ŞİRKETİ,ALSANCAK MAH. ATATÜRK CAD. ÖKMEN NO: 366/1B KONAK / İZMİR
2091951,223244,ANONİM,ADALET,BAYRAKLI,49,GAYRİMENKUL FAALİYETLERİ GRUBU,TASEYAPI İNŞAAT VE GAYRİMENKUL ANONİM ŞİRKETİ ,ADALET MAHALLESİ MANAS BLV. NO: 47B İÇ KAPI NO: 3501 BAYRAKLI / İZMİR
1403151,153237,LİMİTED,EMREZ,GAZİEMİR,49,GAYRİMENKUL FAALİYETLERİ GRUBU,TAŞKAT İNŞAAT TURİZM AKARYAKIT TAŞIMACILIK TARIM HAYVANCILIK OTOMOTİV SANAYİ VE TİCARET LİMİTED ŞİRKETİ,EMREZ MAHALLESİ ALTAN AYDIN CD. NO:52 GAZİEMİR / İZMİR
2033051,217324,LİMİTED,ADALET,BAYRAKLI,49,GAYRİMENKUL FAALİYETLERİ GRUBU,TAYMAZYOL EĞİTİM TURİZM VE GAYRİMENKUL SANAYİ TİCARET LİMİTED ŞİRKETİ,ADALET MAHALLESİ ŞEHİT POLİS FETİH SEKİN CAD. NO:6/174 BAYRAKLI / İZMİR
2301680,251617,LİMİTED,İNÖNÜ,KARŞIYAKA,49,GAYRİMENKUL FAALİYETLERİ GRUBU,TÇ CONSULT ENERJİ YATIRIM VE EMLAK DANIŞMANLIĞI SANAYİ VE TİCARET LİMİTED ŞİRKETİ,İNÖNÜ MAH. 6660 SK. SOYAK TOPLU KONUT SİTESİ NO: 34/7 İÇ KAPI NO: 30 KARŞIYAKA / İZMİR
2295875,245789,ANONİM,ADALET,BAYRAKLI,49,GAYRİMENKUL FAALİYETLERİ GRUBU,TEKGÜL YATIRIM DANIŞMANLIĞI İNŞAAT TARIM SANAYİ TİCARET ANONİM ŞİRKETİ,ADALET MAH. MANAS BUL. NO: 39 İÇ KAPI NO: 3201 BAYRAKLI / İZMİR
1696491,183525,ANONİM,ONUR,BALÇOVA,49,GAYRİMENKUL FAALİYETLERİ GRUBU,TEKİNALP ORGANİZASYON SANAYİ VE TİCARET ANONİM ŞİRKETİ ,ONUR MAHALLESİ ÇAĞLA SK. NO:28/D H.H YILDIZ BLOK BALÇOVA / İZMİR
1739281,47951,ANONİM,GAZİ,GAZİEMİR,49,GAYRİMENKUL FAALİYETLERİ GRUBU,TEKNİKEL MAKİNA VE OTOMOTİV SANAYİ VE TİCARET ANONİM ŞİRKETİ,GAZİ MAH. AKÇAY CAD. NO: 168A GAZİEMİR / İZMİR
2235251,237671,ANONİM,TUNA,BORNOVA,49,GAYRİMENKUL FAALİYETLERİ GRUBU,TEMSİL GAYRİMENKUL YATIRIM ANONİM ŞİRKETİ ,TUNA MAHALLESİ 5500 SOKAK NO: 2 İÇ KAPI NO: 202 BORNOVA / İZMİR
2262001,240367,LİMİTED,ULUCAK MUSTAFA KEMAL ATATÜRK,KEMALPAŞA,49,GAYRİMENKUL FAALİYETLERİ GRUBU,TENHA MADENCİLİK İNŞAAT GAYRİMENKUL GÜNEŞ ENERJİ SİSTEMLERİ GIDA  TARIM HAYVANCILIK SANAYİ VE TİCARET LİMİTED ŞİRKETİ,ULUCAK MUSTAFA KEMAL ATATÜRK MAHALLESİ ULUCAK İZMİR CD. NO: 8/E İÇ KAPI NO: 1 KEMALPAŞA / İZMİR
1888521,202776,ANONİM,MANSUROĞLU,BAYRAKLI,49,GAYRİMENKUL FAALİYETLERİ GRUBU,TEOK GAYRİMENKUL YATIRIM DANIŞMANLIĞI ANONİM ŞİRKETİ,MANSUROĞLU MAHALLESİ 283/1 SK. NO: 10 B BAYRAKLI/İZMİR
2301961,251898,ANONİM,TUNA,BORNOVA,49,GAYRİMENKUL FAALİYETLERİ GRUBU,TEOS GAYRİMENKUL ANONİM ŞİRKETİ,TUNA MAH. 5500 SK. NO: 2 İÇ KAPI NO: 201 BORNOVA / İZMİR
2304005,253948,LİMİTED,HIDIRLIK,SEFERİHİSAR,49,GAYRİMENKUL FAALİYETLERİ GRUBU,TEOSLU ALTINER GAYRİMENKUL YATIRIM DANIŞMANLIĞI LİMİTED ŞİRKETİ,HIDIRLIK MAH. KURTULUŞ CAD. NO: 2/1 İÇ KAPI NO: 1 SEFERİHİSAR / İZMİR
2302013,251952,ANONİM,AOSB,ÇİĞLİ,49,GAYRİMENKUL FAALİYETLERİ GRUBU,TEPAŞ GAYRİMENKUL GELİŞTİRME ANONİM ŞİRKETİ,AOSB MAH. 10001 SK. NO: 5 ÇİĞLİ / İZMİR
1298721,142010,LİMİTED,MANSUROĞLU,BAYRAKLI,49,GAYRİMENKUL FAALİYETLERİ GRUBU,"TEPEKULE GAYRİMENKUL VE YATIRIM DANIŞMANLIĞI, EKSPERTİZ TİCARET LİMİTED ŞİRKETİ",MANSUROĞLU MAHALLESİ 1593/1 SOK. NO:32 İNCEMEMED PLAZA DAİRE:2 BAYRAKLI / İZMİR
399981,58611,ANONİM,ALSANCAK,KONAK,49,GAYRİMENKUL FAALİYETLERİ GRUBU,TEPELER İNŞAAT TURİZM VE TİCARET ANONİM ŞİRKETİ,ALSANCAK MAH. PROF. DR. NUSRET H. FİŞEK CAD. NO: 3 KONAK / İZMİR
2294239,244136,ANONİM,ADALET,BAYRAKLI,49,GAYRİMENKUL FAALİYETLERİ GRUBU,TER RA GAYRİMENKUL DEĞERLEME VE DANIŞMANLIK ANONİM ŞİRKETİ İZMİR ŞUBESİ,ADALET MAH. MANAS BUL. FOLKART TOWERS BLOK NO: 47B İÇ KAPI NO: 2809 BAYRAKLI / İZMİR
510021,590,LİMİTED,ÇAMLIK,BUCA,49,GAYRİMENKUL FAALİYETLERİ GRUBU,TERZİ İNŞAAT SANAYİ VE TİCARET LİMİTED ŞİRKETİ,ÇAMLIK MAH. HOMEROS BUL. MİMOZA NO: 191B İÇ KAPI NO: B BUCA / İZMİR
2299923,249844,LİMİTED,YAKAKÖY,BORNOVA,49,GAYRİMENKUL FAALİYETLERİ GRUBU,TESERA GAYRİMENKUL İNŞAAT TAAHHÜT E-TİCARET TURİZM SANAYİ VE TİCARET LİMİTED ŞİRKETİ,YAKAKÖY MAH. MELTEM SK. NO: 4 BORNOVA / İZMİR
1198041,132773,LİMİTED,KÜLTÜR,KONAK,49,GAYRİMENKUL FAALİYETLERİ GRUBU,TEZ TURİZM VE TİCARET LİMİTED ŞİRKETİ,KÜLTÜR MAH. 1390 SK. CEMİL MİDİLLİ NO: 7A İÇ KAPI NO: 7A KONAK / İZMİR
1846801,198550,ANONİM,BOYALIK,ÇEŞME,49,GAYRİMENKUL FAALİYETLERİ GRUBU,THE CHESME TESİS YÖNETİM HİZMETLERİ ANONİM ŞİRKETİ,BOYALIK MAHALLESİ 3424 SK. NO: 1/1 ÇEŞME/İZMİR
2234951,237652,ANONİM,YALI,KARŞIYAKA,49,GAYRİMENKUL FAALİYETLERİ GRUBU,THE DESIGN GAYRİMENKUL ANONİM ŞİRKETİ ,YALI MAHALLESİ 6471 SK. NO: 27 İÇ KAPI NO: 11 KARŞIYAKA / İZMİR
2265091,240683,LİMİTED,YALI,KARŞIYAKA,49,GAYRİMENKUL FAALİYETLERİ GRUBU,THE PORTFOLIO GAYRİMENKUL DANIŞMANLIK LİMİTED ŞİRKETİ ,YALI MAHALLESİ 6440/4 SK. NO:1 İÇ KAPI NO: 2 KARŞIYAKA / İZMİR
2275391,241721,LİMİTED,ADALET,BAYRAKLI,49,GAYRİMENKUL FAALİYETLERİ GRUBU,THE WOLF REALTY İNŞAAT EMLAK ELEKTRİK MEDYA VE DIŞ TİCARET LİMİTED  ŞİRKETİ,ADALET MAHALLESİ MANAS BUL. FOLKART TOWERS BLOK NO: 47B DAİRE:2809 BAYRAKLI / İZMİR
1878771,201788,LİMİTED,MUSTAFA KEMAL,KARŞIYAKA,49,GAYRİMENKUL FAALİYETLERİ GRUBU,TİME KURUMSAL YÖNETİM DANIŞMANLIĞI VE TURİZM HİZMETLERİ LİMİTED  ŞİRKETİ,MUSTAFA KEMAL MAHALLESİ 6753/8 SK. NO: 15D İÇ KAPI NO: 2 KARŞIYAKA / İZMİR
2296106,246020,LİMİTED,BOSTANLI,KARŞIYAKA,49,GAYRİMENKUL FAALİYETLERİ GRUBU,TNC PORTFÖY YATIRIM GELİŞTİRME LİMİTED ŞİRKETİ,BOSTANLI MAH. CENGİZ TOPEL CAD. KAHRAMAN NO: 36 İÇ KAPI NO: 4 KARŞIYAKA / İZMİR
1954531,209419,ANONİM,ADALET,BAYRAKLI,49,GAYRİMENKUL FAALİYETLERİ GRUBU,TOGA GLOBAL İNŞAAT SANAYİ VE TİCARET ANONİM ŞİRKETİ ,ADALET MAHALLESİ MANAS BULVARI NO: 39 İÇ KAPI NO: 3803 BAYRAKLI / İZMİR
2183001,232399,LİMİTED,GÜNGÖR,KONAK,49,GAYRİMENKUL FAALİYETLERİ GRUBU,TOPÇU DANIŞMANLIK EMLAK İNŞAAT REKLAM ORGANİZASYON İTHALAT  İHRACAT LİMİTED ŞİRKETİ,GÜNGÖR MAHALLESİ 350 SK. NO: 60B KONAK / İZMİR
2268071,240982,LİMİTED,ÇINARLI,KONAK,49,GAYRİMENKUL FAALİYETLERİ GRUBU,TOPRAK DORUK GAYRİMENKUL DANIŞMANLIK SANAYİ VE TİCARET LİMİTED ŞİRKETİ,ÇINARLI MAH. OZAN ABAY CAD. EGEPERLA NO: 8 İÇ KAPI NO: Z17 KONAK / İZMİR
2218601,235987,ANONİM,TUNA,BORNOVA,49,GAYRİMENKUL FAALİYETLERİ GRUBU,TOWER GAYRİMENKUL YATIRIM ANONİM ŞİRKETİ ,TUNA MAHALLESİ YAVUZ SELİM CAD. NO:2/3 ÇAMDİBİ BORNOVA / İZMİR
2051901,219206,ANONİM,ADALET,BAYRAKLI,49,GAYRİMENKUL FAALİYETLERİ GRUBU,TOWNART GAYRİMENKUL ANONİM ŞİRKETİ,ADALET MAH. 1593/1 SK. NO: 45 İÇ KAPI NO: 1 BAYRAKLI / İZMİR
2295390,245304,LİMİTED,İNKILAP,BUCA,49,GAYRİMENKUL FAALİYETLERİ GRUBU,TRABZON GAYRİMENKUL EMLAK TEMİZLİK HİZMETLERİ TURİZM İNŞAAT VE TİCARET LİMİTED ŞİRKETİ İZMİR BUCA ŞUBESİ,İNKILAP MAH. MEHMET AKİF CAD. NO: 3 İÇ KAPI NO: 205 BUCA / İZMİR
2235241,237670,ANONİM,TUNA,BORNOVA,49,GAYRİMENKUL FAALİYETLERİ GRUBU,TRADE GAYRİMENKUL YATIRIM ANONİM ŞİRKETİ,TUNA MAH. 5500 SK. NO: 2 İÇ KAPI NO: 202 BORNOVA / İZMİR
2295634,245544,LİMİTED,EVKA 3,BORNOVA,49,GAYRİMENKUL FAALİYETLERİ GRUBU,TRH KAPİTAL EMLAK YATIRIM DANIŞMANLIĞI TURİZM TİCARET LİMİTED ŞİRKETİ,EVKA 3 MAH. 121/4 SK. ÇITAK SİTESİ NO: 3B BORNOVA / İZMİR
1124921,125453,LİMİTED,ÇAMTEPE,NARLIDERE,49,GAYRİMENKUL FAALİYETLERİ GRUBU,TRİO GAYRİMENKUL DANIŞMANLIK VE TİCARET LİMİTED ŞİRKETİ- NARLIDERE ŞUBESİ,ÇAMTEPE MAHALLESİ GÜNGÖREN CADDESI NARLIDERE / İZMİR
2304526,254475,LİMİTED,ÇAMTEPE,NARLIDERE,49,GAYRİMENKUL FAALİYETLERİ GRUBU,TRİO3 GAYRİMENKUL EMLAK TURİZM GIDA İNŞAAT TAAHHÜT DANIŞMANLIK LİMİTED ŞİRKETİ,ÇAMTEPE MAH. POLİS SK. NO: 9 İÇ KAPI NO: 1 NARLIDERE / İZMİR
2303589,253531,LİMİTED,KONAK,KONAK,49,GAYRİMENKUL FAALİYETLERİ GRUBU,TRMAX GAYRİMENKUL İNŞAAT OTOMOTİV TURİZM GIDA SANAYİ TİCARET LİMİTED ŞİRKETİ,KONAK MAH. CUMHURİYET BUL. KONAK İŞHANI NO: 24 İÇ KAPI NO: 76 KONAK / İZMİR
