Oda Sicil No,Ticari Sicil No,Şirket Türü,Mahalle Adı,İlçe Adı,Meslek Grubu Numarası,Meslek Grubu Adı,Ünvanı,Tescilli Adresi
2049271,218956,ANONİM,ŞEMİKLER,KARŞIYAKA,44,YOLCU TAŞIMA GRUBU,BODURLAR OTOMOTİV TAŞIMACILIK TURİZM SANAYİ VE TİCARET ANONİM ŞİRKETİ,ŞEMİKLER MAHALLESİ 6276 SK. NO: 30/10 KARŞIYAKA/İZMİR
2120881,226155,LİMİTED,ERGENE,BORNOVA,44,YOLCU TAŞIMA GRUBU,BORNOVA BİRLİK TAŞIMACILIK TURİZM OTOMOTİV PETROL SANAYİ VE TİCARET LİMİTED ŞİRKETİ,ERGENE MAHALLESİ 528 SOK. A.SEVEN 3 BLOK NO: 6 BORNOVA / İZMİR
1203031,133407,LİMİTED,KARACAOĞLAN,BORNOVA,44,YOLCU TAŞIMA GRUBU,BOŞNAKOĞLU TURİZM OTOMOTİV AKARYAKIT BİLİŞİM TEKSTİL GIDA İNŞAAT TAAHHÜT NAKLİYE SANAYİ VE TİCARET LİMİTED ŞİRKETİ,KARACAOĞLAN MAHALLESİ 6253 SOKAK NO:8 DAİRE:14 BORNOVA / İZMİR
993581,109892,ANONİM,9 EYLÜL,GAZİEMİR,44,YOLCU TAŞIMA GRUBU,BOZŞAHİNLER TAŞIMACILIK TURİZM PETROL OTOMOTİV TEKSTİL GIDA SANAYİ VE TİCARET ANONİM  ŞİRKETİ,9 EYLÜL MAHALLESİ 307 SOK. NO:6 GAZİEMİR / İZMİR
2304986,254935,LİMİTED,GÜMÜŞPALA,BAYRAKLI,44,YOLCU TAŞIMA GRUBU,BRN ALABAY TAŞIMACILIK TURİZM OKUL VE PERSONEL SERVİSLERİ OTOMOTİV TİCARET VE SANAYİ LİMİTED ŞİRKETİ,GÜMÜŞPALA MAH. 7000 SK. NO: 25 İÇ KAPI NO: 1 BAYRAKLI / İZMİR
2300394,250324,ANONİM,ALSANCAK,KONAK,44,YOLCU TAŞIMA GRUBU,BSG MEDİKAL TURİZM OTELCİLİK SANAYİ VE TİCARET ANONİM ŞİRKETİ,ALSANCAK MAH. KIBRIS ŞEHİTLERİ CAD. ÖZEL KENT ALSANCAK TIP MERKEZİ NO: 140 İÇ KAPI NO: 140 KONAK / İZMİR
2271261,241306,LİMİTED,FIRAT,BUCA,44,YOLCU TAŞIMA GRUBU,BUCALI TAŞIMACILIK VE ARAÇ KİRALAMA TİCARET LİMİTED ŞİRKETİ,FIRAT MAH. 294/2 SK. B BLOK NO: 7A İÇ KAPI NO: 3 BUCA / İZMİR
1418081,154554,LİMİTED,CÜNEYTBEY,MENDERES,44,YOLCU TAŞIMA GRUBU,BUL-TUR PETROL GIDA TURİZM TAŞIMACILIK İNŞAAT SANAYİ TİCARET LİMİTED ŞİRKETİ,CÜNEYTBEY MAH. 638 SK. NO: 2 İÇ KAPI NO: 1 MENDERES / İZMİR
2104961,224550,LİMİTED,KIZILÜZÜM,KEMALPAŞA,44,YOLCU TAŞIMA GRUBU,BULUT GRUP TURİZM TİCARET LİMİTED ŞİRKETİ ,KIZILÜZÜM MAHALLESİ KEMALPAŞA KIZILÜZÜM CAD. NO: 15/2 İÇ KAPI NO: 1 KEMALPAŞA / İZMİR
1733621,187137,LİMİTED,KÜNER,MENDERES,44,YOLCU TAŞIMA GRUBU,BURAK CAN TAŞIMACILIK OTOMOTİV TURİZM İNŞAAT GIDA SANAYİ VE TİCARET LİMİTED ŞİRKETİ,KÜNER MAHALLESİ NO:376 KÜNER KÜME EVLERİ MENDERES / İZMİR
1831371,196976,LİMİTED,CENNETOĞLU,KARABAĞLAR,44,YOLCU TAŞIMA GRUBU,BURAK TURKUAZ TURİZM OTOMOTİV İNŞAAT SANAYİ VE TİCARET LİMİTED ŞİRKETİ,CENNETOĞLU MAHALLESİ YEŞİLLİK CAD. NO: 228 -230/618 KARABAĞLAR/İZMİR
1619401,175829,LİMİTED,KAZIM DİRİK,BORNOVA,44,YOLCU TAŞIMA GRUBU,BÜYÜK EFES ARAÇ KİRALAMA İNŞAAT GIDA NAKLİYE TURİZM TARIM VE HAYVANCILIK SANAYİ TİCARET LİMİTED ŞİRKETİ,KAZIM DİRİK MAHALLESİ GEDİZ CAD. NO:15/1-C BORNOVA / İZMİR
1944501,208397,LİMİTED,BEYAZEVLER,GAZİEMİR,44,YOLCU TAŞIMA GRUBU,BY ATLI SERVİS TAŞIMACILIĞI ARAÇ ALIM SATIM VE KİRALAMA HİZMETLERİ TİCARET LİMİTED ŞİRKETİ,BEYAZEVLER MAH. 556 SK. NO: 41D GAZİEMİR / İZMİR
1309001,144006,LİMİTED,TELEFERİK,BALÇOVA,44,YOLCU TAŞIMA GRUBU,CAFER KALIR TURİZM TAŞIMACILIK NAKLİYE TİCARET LİMİTED ŞİRKETİ,TELEFERİK MAHALLESİ HALİTZİYA BLV. NO:13 DAİRE:3 BALÇOVA/İZMİR
1899101,203812,LİMİTED,2. İNÖNÜ,NARLIDERE,44,YOLCU TAŞIMA GRUBU,CAN ANADOLU TURİZM TAŞIMACILIK HAFRİYAT OTO KİRALAMA İNŞAAT SANAYİ TİCARET LİMİTED ŞİRKETİ,2. İNÖNÜ MAHALLESİ MUSA ANTER SK. NARKENT KONUT YAPI KOOP SİT. 44 APT. NO: 54 /1/3 NARLIDERE/İZMİR
2013851,215391,LİMİTED,KAZIMDİRİK,BORNOVA,44,YOLCU TAŞIMA GRUBU,CAN EGE TAŞIMACILIK TURİZM SEYAHAT TİCARET LİMİTED ŞİRKETİ ,KAZIMDİRİK MAHALLESİ 196 SOKAK NO: 10 A-/- BORNOVA / İZMİR
1986191,212606,LİMİTED,LİMONTEPE,KARABAĞLAR,44,YOLCU TAŞIMA GRUBU,CAN KARDEŞLER SEYAHAT TURİZM GIDA İNŞAAT SANAYİ VE TİCARET LİMİTED ŞİRKETİ,LİMONTEPE MAHALLESİ 9755 SK. NO: 77/4 KARABAĞLAR/İZMİR
1815561,195392,LİMİTED,GÖKSU,BUCA,44,YOLCU TAŞIMA GRUBU,CANAN AYDIN TURİZM TAŞIMACILIK İNŞAAT GIDA SANAYİ TİCARET LİMİTED ŞİRKETİ,GÖKSU MAHALLESİ 687/7 SK. NO: 59/1 BUCA/İZMİR
1028351,114435,LİMİTED,ŞEMİKLER,KARŞIYAKA,44,YOLCU TAŞIMA GRUBU,CANMİT OTOMOTİV NAKLİYE TEKSTİL SANAYİ VE TİCARET LİMİTED ŞİRKETİ ,ŞEMİKLER MAHALLESİ ERDOĞAN AKKAYA SOKAK NO:49 DAİRE:14 KARŞIYAKA / İZMİR
2144181,228495,LİMİTED,ALİ FUAT CEBESOY,KARABAĞLAR,44,YOLCU TAŞIMA GRUBU,CANSIN TAŞIMACILIK SERVİS VE TURİZM TİCARET LİMİTED ŞİRKETİ ,ALİ FUAT CEBESOY MAH. 9504 SK.NO: 3 İÇ KAPI 7 KARABAĞLAR / İZMİR
2299267,249184,LİMİTED,DOKUZ EYLÜL,GAZİEMİR,44,YOLCU TAŞIMA GRUBU,CARPARKCARRENTAL TAŞIMACILIK LİMİTED ŞİRKETİ,DOKUZ EYLÜL MAH. 342 SK. NO: 2 İÇ KAPI NO: 106 GAZİEMİR / İZMİR
2035601,217583,ANONİM,MALTEPE,GÜZELBAHÇE,44,YOLCU TAŞIMA GRUBU,CATALOGIC CATAMARAN YATÇILIK ANONİM ŞİRKETİ,MALTEPE MAH. 116 SK. NO: 2 GÜZELBAHÇE / İZMİR
1949751,208939,LİMİTED,SOĞUKKUYU,BAYRAKLI,44,YOLCU TAŞIMA GRUBU,CBN ENERJİ LİMİTED ŞİRKETİ,SOĞUKKUYU MAH. 1847/14 SK. NO: 3 İÇ KAPI NO: 4 BAYRAKLI / İZMİR
2261911,240357,LİMİTED,BAYRAKLI,BAYRAKLI,44,YOLCU TAŞIMA GRUBU,CEMAL KIRKPINAR TAŞIMACILIK OTOMOTİV TİCARET LİMİTED ŞİRKETİ,BAYRAKLI MAH. ANADOLU CAD. NO: 45/6B BAYRAKLI / İZMİR
2298918,248830,LİMİTED,BALATÇIK,ÇİĞLİ,44,YOLCU TAŞIMA GRUBU,CEMALSAFKALP TURİZM TAŞIMACILIK LİMİTED ŞİRKETİ,BALATÇIK MAH. 8790/1 SK. NO: 63 İÇ KAPI NO: 1 ÇİĞLİ / İZMİR
2296587,246504,LİMİTED,MEHMET AKİF ERSOY,KEMALPAŞA,44,YOLCU TAŞIMA GRUBU,CEMAY TAŞIMACILIK OTOMOTİV İNŞAAT TURİZM SANAYİ VE TİCARET LİMİTED ŞİRKETİ,MEHMET AKİF ERSOY MAH. 238 SK. NO: 11 İÇ KAPI NO: 1 KEMALPAŞA / İZMİR
1553731,168016,LİMİTED,ERZENE,BORNOVA,44,YOLCU TAŞIMA GRUBU,CENGİZLER1 TAŞIMACILIK HAYVANCILIK GIDA SANAYİ VE TİCARET LİMİTED ŞİRKETİ,ERZENE MAH. GENÇLİK CAD. PARK BLOK NO: 5A İÇ KAPI NO: 1 BORNOVA / İZMİR
2304360,254305,LİMİTED,MUSTAFA KEMAL,KARŞIYAKA,44,YOLCU TAŞIMA GRUBU,CEY TAŞIMACILIK TURİZM OTOMOTİV SANAYİ VE TİCARET LİMİTED ŞİRKETİ,MUSTAFA KEMAL MAH. 6753/9 SK. ESIN SITESI SİTESİ KARDELEN NO: 4 İÇ KAPI NO: 17 KARŞIYAKA / İZMİR
2035971,217615,LİMİTED,CÜNEYTBEY,MENDERES,44,YOLCU TAŞIMA GRUBU,CEYDA OTOMOTİV TURİZM NAKLİYE LİMİTED ŞİRKETİ,CÜNEYTBEY MAHALLESİ İBRAHİM TURAN CAD. NO: 5/201 MENDERES/İZMİR
905131,100520,ANONİM,BOSTANLI,KARŞIYAKA,44,YOLCU TAŞIMA GRUBU,CİRİT TURİZM OTOMOTİV TAŞIMACILIK İNŞAAT SANAYİ VE TİCARET ANONİM ŞİRKETİ,BOSTANLI MAH. CENGİZ TOPEL CAD. NO: 21 İÇ KAPI NO: 3 KARŞIYAKA / İZMİR
2061831,220213,LİMİTED,İSMET KAPTAN,KONAK,44,YOLCU TAŞIMA GRUBU,CKY TAŞIMACILIK MAKİNA TURİZM İNŞAAT SANAYİ VE TİCARET LİMİTED  ŞİRKETİ,İSMET KAPTAN MAHALLESİ ŞAİR EŞREF BULVARI NO:26/42 YÖRSAN İŞMERKEZİ Apt. KONAK / İZMİR
2083681,222419,ANONİM,GAZİ,GAZİEMİR,44,YOLCU TAŞIMA GRUBU,CNL TURİZM ANONİM ŞİRKETİ,GAZİ MAHALLESİ KEMAL REİS CAD. NO: 43/12 GAZİEMİR/İZMİR
2077331,221767,LİMİTED,KEMALPAŞA,BORNOVA,44,YOLCU TAŞIMA GRUBU,CVN TURİZM TAŞIMACILIK SANAYİ VE TİCARET LİMİTED ŞİRKETİ ,KEMALPAŞA MAHALLESİ 7419/11 SOKAK NO:124/A BORNOVA / İZMİR
979601,109311,LİMİTED,ATAŞEHİR,ÇİĞLİ,44,YOLCU TAŞIMA GRUBU,ÇAĞDAŞ LOJİSTİK KARGO TAŞIMACILIK NAKLİYE İNŞAAT TİCARET LİMİTED ŞİRKETİ,ATAŞEHİR MAH. 8273 SK. TURNA NO: 3B ÇİĞLİ / İZMİR
508011,89472,LİMİTED,GÖZTEPE,KONAK,44,YOLCU TAŞIMA GRUBU,ÇAĞDAŞ TAŞIMACILIK VE TİCARET VE LİMİTED ŞİRKETİ ,GÖZTEPE MAHALLESİ 90 SOKAK NO:10 KONAK / İZMİR
1634661,177347,LİMİTED,BAHÇELİEVLER,KARŞIYAKA,44,YOLCU TAŞIMA GRUBU,ÇAĞIL MEDİKAL TAŞIMACILIK İNŞAAT SANAYİ VE TİCARET LİMİTED ŞİRKETİ,BAHÇELİEVLER MAHALLESİ GÜN SAZAK BLV. NO:41/7 KARŞIYAKA / İZMİR
1961411,210109,LİMİTED,RAFETPAŞA,BORNOVA,44,YOLCU TAŞIMA GRUBU,ÇAĞLAN TURİZM SERVİS TAŞIMACILIK HİZMETLERİ OTOMOTİV SANAYİ VE TİCARET LİMİTED ŞİRKETİ,RAFETPAŞA MAHALLESİ 5499/1 SOKAK NO:8/3 BORNOVA / İZMİR
2278811,242065,ANONİM,ÇAMTEPE,NARLIDERE,44,YOLCU TAŞIMA GRUBU,ÇAKAN VİP TURİZM TAŞIMACILIK SANAYİ TİCARET ANONİM ŞİRKETİ,ÇAMTEPE MAH. GÜNGÖREN CAD. DENİZ NO: 50 İÇ KAPI NO: 1 NARLIDERE / İZMİR
892171,98806,LİMİTED,GÜNEŞLİ,KONAK,44,YOLCU TAŞIMA GRUBU,ÇAKANOĞLU GRUP TAŞIMACILIK TURİZM SANAYİ VE TİCARET LİMİTED ŞİRKETİ ,GÜNEŞLİ MAHALLESİ 528/1 SOKAK NO:6/7 KONAK / İZMİR
2303613,253556,LİMİTED,ÖRNEKKÖY,KARŞIYAKA,44,YOLCU TAŞIMA GRUBU,ÇAKATAY TURİZM LİMİTED ŞİRKETİ,ÖRNEKKÖY MAH. 1847/7 SK. NO: 17A KARŞIYAKA / İZMİR
2273891,241560,LİMİTED,KEMAL REİS,KONAK,44,YOLCU TAŞIMA GRUBU,ÇAKICI GROUP TURİZM TAŞIMACILIK OTOMOTİV İNŞAAT SANAYİ VE TİCARET  LİMİTED ŞİRKETİ,KEMAL REİS MAHALLESİ ŞÜKRÜ SARAÇOĞLU CAD. NO:134 DAİRE:1 KONAK / İZMİR
2173151,231410,LİMİTED,MUSTAFA KEMAL,BUCA,44,YOLCU TAŞIMA GRUBU,ÇAYMAZ TURİZM TAŞIMACILIK SANAYİ VE TİCARET LİMİTED ŞİRKETİ ,MUSTAFA KEMAL MAHALLESİ 686/25 SK. NO: 6 İÇ KAPI NO: 2 BUCA / İZMİR
2199461,234069,LİMİTED,ÖREN 75. YIL CUMHURİYET,KEMALPAŞA,44,YOLCU TAŞIMA GRUBU,ÇELEBİ GRUP TURİZM SANAYİ VE TİCARET LİMİTED ŞİRKETİ ,ÖREN 75. YIL CUMHURİYET MAHALLESİ MÜCAHİT SK. NO: 20 İÇ KAPI NO: 1 KEMALPAŞA / İZMİR
1738021,187582,LİMİTED,ORGENERAL NAFİZ GÜRMAN,BAYRAKLI,44,YOLCU TAŞIMA GRUBU,ÇETİNKAYA TAŞIMACILIK OTOMOTİV TURİZM İNŞAAT GIDA NAKLİYAT HAYVANCILIK PETROL SANAYİ VE TİCARET LİMİTED ŞİRKETİ,ORGENERAL NAFİZ GÜRMAN MAHALLESİ KUBİLAY CAD. NO: 90 A/0 BAYRAKLI / İZMİR
2301380,251308,LİMİTED,BUCA KOOP,BUCA,44,YOLCU TAŞIMA GRUBU,ÇİMEN PERSONEL VE ÖĞRENCİ TAŞIMACILIĞI TURİZM İNŞAAT OTOMOTİV SANAYİ TİCARET LİMİTED ŞİRKETİ,BUCA KOOP MAH. 200/69 SK. İŞKENT SİTESİ KARDELEN NO: 16B İÇ KAPI NO: 5 BUCA / İZMİR
1879691,201882,LİMİTED,AKSOY,KARŞIYAKA,44,YOLCU TAŞIMA GRUBU,ÇİNGENE YATÇILIK TURİZM TİCARET LİMİTED ŞİRKETİ,AKSOY MAH. YALI BUL. NO: 386 İÇ KAPI NO: 2 KARŞIYAKA / İZMİR
1858741,199753,LİMİTED,ERZENE,BORNOVA,44,YOLCU TAŞIMA GRUBU,ÇOBANTUR LOJİSTİK TAŞIMACILIK TURİZM SANAYİ VE TİCARET LİMİTED ŞİRKETİ,ERZENE MAHALLESİ 15 SK. NO: 8 A/_ BORNOVA/İZMİR
740441,10980,LİMİTED,KARACAOĞLAN,BORNOVA,44,YOLCU TAŞIMA GRUBU,ÇÜNGÜŞLÜ TURİZM TAŞIMACILIK İNŞAAT HAYVANCILIK VE GIDA SANAYİ TİCARET LİMİTED ŞİRKETİ,KARACAOĞLAN MAHALLESİ KEMALPAŞA CAD. NO:285/Z076 BORNOVA / İZMİR
1829171,196773,ANONİM,MEHMET ALİ AKMAN,KONAK,44,YOLCU TAŞIMA GRUBU,D N D TURİZM TAŞIMACILIK ANONİM ŞİRKETİ,MEHMET ALİ AKMAN MAHALLESİ MUSTAFA KEMAL SAHİL BLV. NO: 801 A-801B/_ KONAK/İZMİR
2062811,220315,LİMİTED,RAFET PAŞA,BORNOVA,44,YOLCU TAŞIMA GRUBU,DAL TAŞIMACILIK SANAYİ VE TİCARET LİMİTED ŞİRKETİ,RAFET PAŞA MAHALLESİ 5241 SK. NO: 7 A BORNOVA/İZMİR
2168571,230942,LİMİTED,DAMLACIK,KEMALPAŞA,44,YOLCU TAŞIMA GRUBU,DAMLACIK TURİZM TAŞIMACILIK TİCARET VE SANAYİ LİMİTED ŞİRKETİ,DAMLACIK MAH. 9502 SK. NO: 7 İÇ KAPI NO: 1 KEMALPAŞA / İZMİR
2295980,245915,LİMİTED,DAMLACIK,KEMALPAŞA,44,YOLCU TAŞIMA GRUBU,DAMLACIKLI GENÇ TURİZM TAŞIMACILIK LİMİTED ŞİRKETİ,DAMLACIK MAH. 9504 SK. NO: 8 İÇ KAPI NO: 1 KEMALPAŞA / İZMİR
2295325,245229,ANONİM,ÜÇKUYULAR,KARABAĞLAR,44,YOLCU TAŞIMA GRUBU,DAVİVA GROUP İÇ VE DIŞ TİCARET ANONİM ŞİRKETİ İZMİR ŞUBESİ,ÜÇKUYULAR MAH. 73 SK. NO: 11 İÇ KAPI NO: 1 KARABAĞLAR / İZMİR
2297839,247753,LİMİTED,KARABAĞLAR,KARABAĞLAR,44,YOLCU TAŞIMA GRUBU,DAYE TAŞIMACILIK LOJİSTİK TURİZM İNŞAAT MOBİLYA DEKORASYON PAZARLAMA İTHALAT İHRACAT SANAYİ VE TİCARET LİMİTED ŞİRKETİ,KARABAĞLAR MAH. 5770/6 SK. NO: 17 İÇ KAPI NO: 3 KARABAĞLAR / İZMİR
734941,108273,LİMİTED,KEMALPAŞA,BORNOVA,44,YOLCU TAŞIMA GRUBU,DAYI-TUR TURİZM TAŞIMACILIK VE MOTORLU ARAÇLAR SANAYİ TİCARET LİMİTED ŞİRKETİ,KEMALPAŞA MAHALLESİ 7035 SOKAK NO:6 DAİRE:21 BORNOVA / İZMİR
2016651,215671,ANONİM,DOKUZ EYLÜL,GAZİEMİR,44,YOLCU TAŞIMA GRUBU,DC21 İÇ VE DIŞ TİCARET ANONİM ŞİRKETİ ,DOKUZ EYLÜL MAHALLESİ KAHRAMANLAR CAD. NO:5 GAZİEMİR / İZMİR
1113071,123473,LİMİTED,KOZAĞAÇ,BUCA,44,YOLCU TAŞIMA GRUBU,DEĞERLİ OTOMOTİV TURİZM TAŞIMACILIK GIDA HAYVANCILIK SANAYİ VE TİCARET LİMİTED ŞİRKETİ,KOZAĞAÇ MAHALLESİ 261/1 SK. NO: 3A BUCA / İZMİR
1287611,141487,LİMİTED,YEŞİLOVA,BORNOVA,44,YOLCU TAŞIMA GRUBU,DEMBA TURİZM TAŞIMACILIK İNŞAAT OTOMOTİV PETROL ÜRÜNLERİ GIDA TARIM ÜRÜNLERİ SANAYİ VE TİCARET LİMİTED ŞİRKETİ,YEŞİLOVA MAH. 4174/1 SK. LEVENT SERBEST SİTESİ NO: 47A BORNOVA / İZMİR
1933961,207333,ANONİM,ADALET,BAYRAKLI,44,YOLCU TAŞIMA GRUBU,DEMİR GROUP TAŞIMACILIK TURİZM SEYAHAT AKARYAKIT LOJİSTİK İNŞAAT GIDA RESTORAN İŞLETMECİLİĞİ İTHALAT İHRACAT SANAYİ VE TİCARET ANONİM ŞİRKETİ,ADALET MAHALLESİ ANADOLU CAD. NO: 41/101 BAYRAKLI/İZMİR
1192111,132337,LİMİTED,SIĞACIK,SEFERİHİSAR,44,YOLCU TAŞIMA GRUBU,DENİZ TUFAN TURİZM SEYAHAT TAŞIMACILIK GIDA ÜRÜNLERİ İNŞAAT SANAYİ VE TİCARET LİMİTED ŞİRKETİ-SIĞACIK ŞUBESİ,SIĞACIK MAHALLESİ AKKUM CADDESI NO:3/B SEFERİHİSAR / İZMİR
1528951,165467,LİMİTED,ETİLER,KONAK,44,YOLCU TAŞIMA GRUBU,DENİZMARİN DENİZCİLİK YATÇILIK SU SPORLARI SERVİS TURİZM ORGANİZASYON TAŞIMACILIK İNŞAAT GIDA İTHALAT İHRACAT SANAYİ VE TİCARET LİMİTED ŞİRKETİ,ETİLER MAH. 9 EYLÜL MEY. A. BASARAN NO: 12 İÇ KAPI NO: 213 KONAK / İZMİR
1753951,189168,LİMİTED,ATATÜRK,NARLIDERE,44,YOLCU TAŞIMA GRUBU,DENİZSU TURİZM TAŞIMACILIK OTOMOTİV SANAYİ VE TİCARET LİMİTED ŞİRKETİ,ATATÜRK MAH. ERDAL İNÖNÜ CAD. ALTINVADI SİTESİ NO: 13B İÇ KAPI NO: 2 NARLIDERE / İZMİR
1517281,164353,LİMİTED,SOĞUKPINAR,KEMALPAŞA,44,YOLCU TAŞIMA GRUBU,DERDİYOKLAR GIDA TEKSTİL İNŞAAT TAAHHÜT ISI MADDELERİ NAKLİYE TİCARET VE SANAYİ PAZARLAMA LİMİTED ŞİRKETİ KEMALPAŞA İZMİR ŞUBESİ,SOĞUKPINAR MAHALLESİ NO:5/1 KEMALPAŞA / İZMİR
901171,99911,LİMİTED,GAZİ,GAZİEMİR,44,YOLCU TAŞIMA GRUBU,DERVİŞOĞLU TAŞIMACILIK TURİZM YEDEK PARÇA İNŞAAT TAAHHÜT SANAYİ VE TİCARET LİMİTED ŞİRKETİ,GAZİ MAH. HASAN GÜVEN CAD. NO: 124A GAZİEMİR / İZMİR
1397661,152686,LİMİTED,KARACAOĞLAN,BORNOVA,44,YOLCU TAŞIMA GRUBU,DEVA TAŞIMACILIK AKARYAKIT OTO YEDEK PARÇA ORGANİZASYON TARIM ÜRÜNLERİ HAYVANCILIK SANAYİ VE TİCARET LİMİTED ŞİRKETİ,KARACAOĞLAN MAHALLESİ 6253 SOKAK NO:8/A BORNOVA / İZMİR
1290521,141581,LİMİTED,VALİ RAHMİ BEY,BUCA,44,YOLCU TAŞIMA GRUBU,DGY TURİZM TAŞIMACILIK SEYAHAT OTOMOTİV  PETROL ÜRÜNLERİ GIDA VE TEMİZLİK SANAYİ TİCARET LİMİTED ŞİRKETİ,VALİ RAHMİ BEY MAHALLESİ 298 SK. NO:13 DAİRE:1 BUCA / İZMİR
1398901,152811,LİMİTED,SAKARYA,GAZİEMİR,44,YOLCU TAŞIMA GRUBU,DİBA OTO KİRALAMA YAYIN DAĞITIM TAŞIMACILIK TURİZM İNŞAAT SANAYİ VE TİCARET LİMİTED ŞİRKETİ,SAKARYA MAHALLESİ AKÇAY CD. NO:144 GAZİEMİR / İZMİR
1879701,201888,ANONİM,BALATÇIK,ÇİĞLİ,44,YOLCU TAŞIMA GRUBU,DİLAY ORGANİZASYON NAKLİYAT TAŞIMACILIK HAYVANCILIK PETROL  ÜRÜNLERİ TURİZM SANAYİ VE TİCARET ANONİM ŞİRKETİ,BALATÇIK MAHALLESİ 8914 SK. NO:72/52 ÇİĞLİ / İZMİR
2302302,252224,LİMİTED,BALATÇIK,ÇİĞLİ,44,YOLCU TAŞIMA GRUBU,DİLAY SERVİS TAŞIMACILIĞI TURİZM İNŞAAT LİMİTED ŞİRKETİ,BALATÇIK MAH. 8914 SK. NO: 68 İÇ KAPI NO: 5 ÇİĞLİ / İZMİR
2070391,221075,LİMİTED,GÜVEN,BUCA,44,YOLCU TAŞIMA GRUBU,DİNAMİK 35 EV GEREÇLERİ ZÜCCACİYE VE HEDİYELİK EŞYA SANAYİ VE  TİCARET LİMİTED ŞİRKETİ,GÜVEN MAHALLESİ MENDERES CADDESI ÜNLÜSÖL BLOK NO: 292AB BUCA / İZMİR
1764811,190244,LİMİTED,YAYLACIK,BUCA,44,YOLCU TAŞIMA GRUBU,DİPO TURİZM TAŞIMACILIK OTOMOTİV İNŞAAT GIDA SANAYİ VE TİCARET  LİMİTED ŞİRKETİ,YAYLACIK MAHALLESİ BAŞARI CAD. NO:75/5 BUCA / İZMİR
2302833,252768,LİMİTED,AYDIN,KARABAĞLAR,44,YOLCU TAŞIMA GRUBU,DİVERSE TURİZM TAŞIMACILIK VE TİCARET LİMİTED ŞİRKETİ,AYDIN MAH. 4284 SK. NO: 3B KARABAĞLAR / İZMİR
1573201,169968,LİMİTED,DOĞANLAR,BORNOVA,44,YOLCU TAŞIMA GRUBU,DK DEMİRKAYA TURİZM TAŞIMACILIK OTOMOTİV İNŞAAT GIDA LİMAN HİZMETLERİ SANAYİ VE TİCARET LİMİTED ŞİRKETİ,DOĞANLAR MAHALLESİ 1530 SK. NO: 15 A BORNOVA/İZMİR
2099691,224030,LİMİTED,ADALET,BAYRAKLI,44,YOLCU TAŞIMA GRUBU,DLC GLOBAL TURİZM TAŞIMACILIK OTOMOTİV SANAYİ TİCARET LİMİTED  ŞİRKETİ,ADALET MAHALLESİ 2132/2 SK. NO: 3 İÇ KAPI NO: 33 BAYRAKLI / İZMİR
1919251,205860,LİMİTED,SEKİZ EYLÜL,KEMALPAŞA,44,YOLCU TAŞIMA GRUBU,DOĞAN YÖRÜK TURİZM TAŞIMACILIK NAKLİYE GIDA TEMİZLİK TEKSTİL SANAYİ VE TİCARET LİMİTED ŞİRKETİ,SEKİZ EYLÜL MAH. KİRAZLI CAD. NO: 1/7A KEMALPAŞA / İZMİR
824361,90002,LİMİTED,OSMANGAZİ,BAYRAKLI,44,YOLCU TAŞIMA GRUBU,DOĞUKAN TURİZM TAŞIMACILIK TEKSTİL REKLAM TEMİZLİK SANAYİ TİCARET LİMİTED ŞİRKETİ,OSMANGAZİ MAH. OSMANGAZİ CAD. İŞCAN D BLOK NO: 106D BAYRAKLI / İZMİR
2303090,253028,LİMİTED,MENDERES,BUCA,44,YOLCU TAŞIMA GRUBU,DOLUNAY SERVİS TAŞIMACILIĞI ARAÇ KİRALAMA TURİZM TİCARET LİMİTED ŞİRKETİ,MENDERES MAH. 118/3 SK. MURAT NO: 9 İÇ KAPI NO: 6 BUCA / İZMİR
2294277,244175,LİMİTED,BALATÇIK,ÇİĞLİ,44,YOLCU TAŞIMA GRUBU,DONANMACI TURİZM TAŞIMACILIK LİMİTED ŞİRKETİ,BALATÇIK MAH. 8788/9 SK. NO: 3A ÇİĞLİ / İZMİR
2305792,255743,LİMİTED,DOĞANLAR,BORNOVA,44,YOLCU TAŞIMA GRUBU,DOSON TAŞIMACILIK İŞ MAKİNALAR TURİZM HAYVANCILIK GIDA SANAYİ VE TİCARET İTHALAT İHRACAT LİMİTED ŞİRKETİ,DOĞANLAR MAH. 1421 SK. HURDACILAR SİTESİ NO: 37 BORNOVA / İZMİR
2112591,225323,LİMİTED,ADALET,BAYRAKLI,44,YOLCU TAŞIMA GRUBU,DÖNMEZSER TURİZM OTOMOTİV İLETİŞİM SANAYİ VE TİCARET LİMİTED ŞİRKETİ,ADALET MAH. MANAS BUL. FOLKART TOWERS NO: 47B İÇ KAPI NO: 2601 BAYRAKLI / İZMİR
2200891,234199,LİMİTED,GÜNEŞLİ,KONAK,44,YOLCU TAŞIMA GRUBU,DRZ TURİZM TİCARET LİMİTED ŞİRKETİ,GÜNEŞLİ MAH. ESKİİZMİR CAD. NO: 35/1A KONAK / İZMİR
1848761,198752,LİMİTED,GÖKSU,BUCA,44,YOLCU TAŞIMA GRUBU,DURANLAR TAŞIMACILIK TURİZM OTOMOTİV İNŞAAT SANAYİ VE TİCARET  LİMİTED ŞİRKETİ,GÖKSU MAHALLESİ 687/7 SK. NO:1/4 BUCA / İZMİR
1121271,125108,LİMİTED,LALELİ,BUCA,44,YOLCU TAŞIMA GRUBU,DUYGUM TURİZM TAŞIMACILIK PETROL İNŞAAT TEMİZLİK HİZMETLERİ REKLAMCILIK SANAYİ VE TİCARET LİMİTED ŞİRKETİ,LALELİ MAHALLESİ 419/2 SK. NO: 32 B BUCA/İZMİR
683131,81866,LİMİTED,ÇINARLI,KONAK,44,YOLCU TAŞIMA GRUBU,ECU WORLDWIDE TURKEY TAŞIMACILIK LİMİTED ŞİRKETİ İZMİR ŞUBESİ,ÇINARLI MAH. OZAN ABAY CAD. EGEPERLA BLOK NO: 10 İÇ KAPI NO: 055 KONAK / İZMİR
1247551,137893,ANONİM,ADALET,BAYRAKLI,44,YOLCU TAŞIMA GRUBU,EDH GIDA KUYUMCULUK MADENCİLİK TAŞIMACILIK İNŞAAT SANAYİ TİCARET ANONİM ŞİRKETİ,ADALET MAH. MANAS BUL. NO: 12/2 BAYRAKLI / İZMİR
1855671,199438,LİMİTED,BAHÇELİEVLER,KARŞIYAKA,44,YOLCU TAŞIMA GRUBU,EFA TAŞIMACILIK TURİZM SANAYİ VE TİCARET LİMİTED ŞİRKETİ ,BAHÇELİEVLER MAHALLESİ 1828/7 SK. NO: 18 A KARŞIYAKA / İZMİR
1705611,184380,ANONİM,MANSUROĞLU,BAYRAKLI,44,YOLCU TAŞIMA GRUBU,EFE HAVACILIK İŞLETMESİ ANONİM ŞİRKETİ,MANSUROĞLU MAH. ANKARA CAD. NO: 73/1 İÇ KAPI NO: 601 BAYRAKLI / İZMİR
2048521,218868,ANONİM,ÇAMKULE,BORNOVA,44,YOLCU TAŞIMA GRUBU,EFE KATI ATIK HİZMETLERİ ANONİM ŞİRKETİ,ÇAMKULE MAH. 4731 SK. NO: 3/1 BORNOVA / İZMİR
1735191,187308,LİMİTED,ERGENE,BORNOVA,44,YOLCU TAŞIMA GRUBU,EFE ÖZKANLAR TURİZM TAŞIMACILIK OTOMOTİV İNŞAAT SANAYİ VE TİCARET LİMİTED ŞİRKETİ,ERGENE MAH. 456 SK. NO: 72 İÇ KAPI NO: 4 BORNOVA / İZMİR
2223601,236493,LİMİTED,ATAŞEHİR,ÇİĞLİ,44,YOLCU TAŞIMA GRUBU,EFESER TURİZM TAŞIMACILIK OTOMOTİV KİRALAMA İNŞAAT GIDA VE SANAYİ TİCARET LİMİTED ŞİRKETİ,ATAŞEHİR MAH. 8001/3 SK. B- BLOK NO: 7/1C ÇİĞLİ / İZMİR
2303252,253195,LİMİTED,KEMALPAŞA OSB,KEMALPAŞA,44,YOLCU TAŞIMA GRUBU,EFL TURİZM TAŞIMACILIK OTOMOTİV GIDA İNŞAAT SANAYİ VE TİCARET LİMİTED ŞİRKETİ,KEMALPAŞA OSB MAH. GAZİ BUL. NO: 177 İÇ KAPI NO: 24 KEMALPAŞA / İZMİR
1546791,167308,LİMİTED,İNÖNÜ,BORNOVA,44,YOLCU TAŞIMA GRUBU,EGE ARAL TURİZM TAŞIMACILIK OTOMOTİV İNŞAAT SANAYİ VE TİCARET LİMİTED ŞİRKETİ,İNÖNÜ MAHALLESİ 747 SOKAK NO:11/3 BORNOVA / İZMİR
1379451,150863,LİMİTED,KOZAĞAÇ,BUCA,44,YOLCU TAŞIMA GRUBU,EGE BARIŞ TURİZM İNŞAAT TAŞIMACILIK PAZARLAMA SANAYİ VE TİCARET LİMİTED ŞİRKETİ,KOZAĞAÇ MAHALLESİ 220 SK. NO:72/2 BUCA / İZMİR
1976151,211589,LİMİTED,AŞIK VEYSEL,KARABAĞLAR,44,YOLCU TAŞIMA GRUBU,EGE DOĞAN TURİZM TAŞIMACILIK OTOMOTİV YEDEK PARÇA SANAYİ VE  TİCARET LİMİTED ŞİRKETİ,AŞIK VEYSEL MAHALLESİ 5733 SOK. NO: 107 A/A KARABAĞLAR / İZMİR
1868861,200785,LİMİTED,ATIFBEY,GAZİEMİR,44,YOLCU TAŞIMA GRUBU,EGE GÜVEN TAŞIMACILIK TURİZM İNŞAAT SANAYİ VE TİCARET LİMİTED ŞİRKETİ,ATIFBEY MAH. 69 SK. NO: 9 İÇ KAPI NO: 4 GAZİEMİR / İZMİR
1505531,163168,LİMİTED,ÇINARLI,KONAK,44,YOLCU TAŞIMA GRUBU,EGE HAKAN TURİZM SEYAHAT TAŞIMACILIK TİCARET LİMİTED ŞİRKETİ,ÇINARLI MAHALLESİ 1587 SK. NO: 2 -6/1601 KONAK/İZMİR
1813521,195187,LİMİTED,ÖZGÜR,KARABAĞLAR,44,YOLCU TAŞIMA GRUBU,EGE IRMAK TURİZM TAŞIMACILIK SANAYİ VE TİCARET LİMİTED ŞİRKETİ,ÖZGÜR MAH. 3918 SK. NO: 18 İÇ KAPI NO: 1 KARABAĞLAR / İZMİR
1960081,209985,LİMİTED,ÇINARLI,KONAK,44,YOLCU TAŞIMA GRUBU,EGE KAAN TURİZM TAŞIMACILIK DANIŞMANLIK VE TİCARET LİMİTED ŞİRKETİ,ÇINARLI MAHALLESİ 1587 SK. NO: 2 -6/1601 KONAK/İZMİR
2217941,235921,LİMİTED,KARACAOĞLAN,BORNOVA,44,YOLCU TAŞIMA GRUBU,EGE MARMARA SEYAHAT LİMİTED ŞİRKETİ ,KARACAOĞLAN MAHALLESİ KEMALPAŞA CADDESI NO:285 OTOGAR BLOK İÇ KAPI NO: Z088 BORNOVA / İZMİR
2303314,253252,LİMİTED,ADALET,BAYRAKLI,44,YOLCU TAŞIMA GRUBU,EGE MST TURİZM TAŞIMACILIK OTOMOTİV TİCARET LİMİTED ŞİRKETİ,ADALET MAH. ANADOLU CAD. MEGAPOL TOWER NO: 41 İÇ KAPI NO: 081 BAYRAKLI / İZMİR
1584791,172311,LİMİTED,KEMALPAŞA,BORNOVA,44,YOLCU TAŞIMA GRUBU,EGE ZİRVE TUR TAŞIMACILIK TURİZM OTOMOTİV GIDA SANAYİ VE TİCARET LİMİTED ŞİRKETİ,KEMALPAŞA MAH. 7055 SK. NO: 43 İÇ KAPI NO: 2 BORNOVA / İZMİR
2068451,220726,LİMİTED,MERSİNLİ,KONAK,44,YOLCU TAŞIMA GRUBU,EGEDER TURİZM TAŞIMACILIK SANAYİ VE TİCARET LİMİTED ŞİRKETİ,MERSİNLİ MAHALLESİ 2823 SK. NO: 71/201 KONAK/İZMİR
1784561,192248,ANONİM,SİTELER,GÜZELBAHÇE,44,YOLCU TAŞIMA GRUBU,EGEJET HAVACILIK TURİZM GIDA İNŞAAT SANAYİ VE TİCARET ANONİM ŞİRKETİ,SİTELER MAHALLESİ 436 SK. NO: 5 İÇ KAPI NO: 2 GÜZELBAHÇE / İZMİR
2291781,243391,LİMİTED,MERSİNLİ,KONAK,44,YOLCU TAŞIMA GRUBU,EGEJET TURİZM VE YOLCU TAŞIMACILIĞI PETROL İNŞAAT SANAYİ TİCARET LİMİTED ŞİRKETİ,MERSİNLİ MAH. 2823 SK. NO: 71 İÇ KAPI NO: 301 KONAK / İZMİR
2305669,255620,LİMİTED,YEŞİLOVA,BORNOVA,44,YOLCU TAŞIMA GRUBU,EGEJET TURİZM VE YOLCU TAŞIMACILIĞI PETROL İNŞAAT SANAYİ TİCARET LİMİTED ŞİRKETİ BORNOVA ŞUBESİ,YEŞİLOVA MAH. 4109 SK. NO: 1A BORNOVA / İZMİR
2305674,255621,LİMİTED,HÜRRİYET,GAZİEMİR,44,YOLCU TAŞIMA GRUBU,EGEJET TURİZM VE YOLCU TAŞIMACILIĞI PETROL İNŞAAT SANAYİ TİCARET LİMİTED ŞİRKETİ GAZİEMİR ŞUBESİ,HÜRRİYET MAH. BÜYÜK MENDERES CAD. NO: 198/A İÇ KAPI NO: /A GAZİEMİR / İZMİR
1980901,212067,ANONİM,KAHRAMANDERE,GÜZELBAHÇE,44,YOLCU TAŞIMA GRUBU,EGEM YATÇILIK TURİZM SANAYİ VE TİCARET ANONİM ŞİRKETİ ,KAHRAMANDERE MAHALLESİ 524 SK. NO: 8 C/0 GÜZELBAHÇE / İZMİR
1797861,193599,LİMİTED,ATAŞEHİR,ÇİĞLİ,44,YOLCU TAŞIMA GRUBU,EGESE ULAŞIM TAŞIMACILIK TURİZM İNŞAAT SANAYİ TİCARET LİMİTED ŞİRKETİ,ATAŞEHİR MAH. 8001/3 SK. NO: 95 İÇ KAPI NO: 1 ÇİĞLİ / İZMİR
2156691,229750,LİMİTED,EGEMENLİK,BORNOVA,44,YOLCU TAŞIMA GRUBU,EGEVOL TUR TAŞIMACILIK TURİZM NAKLİYE TİCARET LİMİTED ŞİRKETİ,EGEMENLİK MAH. KEMALPAŞA CAD. NO: 242 BORNOVA / İZMİR
1506211,163240,LİMİTED,ATATÜRK,BORNOVA,44,YOLCU TAŞIMA GRUBU,EĞİTMENOĞLU TAŞIMACILIK İNŞAAT TEMİZLİK GIDA OPTİK SANAYİ VE TİCARET LİMİTED ŞİRKETİ,ATATÜRK MAHALLESİ SÜLEYMANİYE CADDESI NO:14/4 BORNOVA / İZMİR
2013951,215402,ANONİM,ATIFBEY,GAZİEMİR,44,YOLCU TAŞIMA GRUBU,EKİMTUR TURİZM TAŞIMACILIK SANAYİ VE TİCARET ANONİM ŞİRKETİ,ATIFBEY MAHALLESİ 5 SK. B BLOK APT. NO: 19/101 GAZİEMİR/İZMİR
2286921,242883,ANONİM,ALSANCAK,KONAK,44,YOLCU TAŞIMA GRUBU,EKOL TRANSPORT ANONİM ŞİRKETİ İZMİR ŞUBESİ,ALSANCAK MAHALLESİ 1479 SK. KRİSTAL 2 İŞ MERKEZİ BLOK NO:15 İÇ KAPI NO:2 KONAK / İZMİR
2067531,220770,LİMİTED,ÇALIKUŞU,KARABAĞLAR,44,YOLCU TAŞIMA GRUBU,ELA PALA TAŞIMACILIK TURİZM İNŞAAT TİCARET VE SANAYİ LİMİTED ŞİRKETİ,ÇALIKUŞU MAH. 3205 SK. NO: 16 İÇ KAPI NO: 3 KARABAĞLAR / İZMİR
1594741,173339,LİMİTED,BAHÇELİEVLER,KARŞIYAKA,44,YOLCU TAŞIMA GRUBU,ELAL TAŞIMACILIK OTOMOTİV İNŞAAT TURİZM SANAYİ VE TİCARET LİMİTED ŞİRKETİ,BAHÇELİEVLER MAHALLESİ 1828/7 SK. NO:18/A KARŞIYAKA / İZMİR
2242321,238375,LİMİTED,ŞEMİKLER,KARŞIYAKA,44,YOLCU TAŞIMA GRUBU,ELATUR TAŞIMACILIK AKARYAKIT İNŞAAT TURİZM SANAYİ VE TİCARET LİMİTED ŞİRKETİ,ŞEMİKLER MAHALLESİ 6283 SK. NO: 18 İÇ KAPI NO: 16 KARŞIYAKA / İZMİR
2246661,238816,LİMİTED,ULUCAK MUSTAFA KEMAL ATATÜRK,KEMALPAŞA,44,YOLCU TAŞIMA GRUBU,ELELE ULAŞIM TURİZM TİCARET LİMİTED ŞİRKETİ ,ULUCAK MUSTAFA KEMAL ATATÜRK MAHALLESİ 35/1 SOKAK NO:5/1 KEMALPAŞA / İZMİR
2275131,241684,LİMİTED,ATIFBEY,GAZİEMİR,44,YOLCU TAŞIMA GRUBU,ELİT EGE TAŞIMACILIK TURİZM İNŞAAT SANAYİ VE TİCARET LİMİTED ŞİRKETİ,ATIFBEY MAH. 69 SK. NO: 9 İÇ KAPI NO: 4 GAZİEMİR / İZMİR
