Oda Sicil No,Ticari Sicil No,Şirket Türü,Mahalle Adı,İlçe Adı,Meslek Grubu Numarası,Meslek Grubu Adı,Ünvanı,Tescilli Adresi
2302038,251975,LİMİTED,YEŞİLOVA,BORNOVA,44,YOLCU TAŞIMA GRUBU,35 AREL TURİZM GIDA TARIM İTHALAT İHRACAT OTOMOTİV SANAYİ TİCARET LİMİTED ŞİRKETİ,YEŞİLOVA MAH. 4174/5 SK. NO: 1 İÇ KAPI NO: 12 BORNOVA / İZMİR
2248181,238980,LİMİTED,KAYNAKLAR MERKEZ,BUCA,44,YOLCU TAŞIMA GRUBU,ABDİ TATAR TURİZM TAŞIMACILIK İNŞAAT VE TİCARET LİMİTED ŞİRKETİ,KAYNAKLAR MERKEZ MAH. 2043 SK. NO: 4 İÇ KAPI NO: 1 BUCA / İZMİR
1816231,195479,LİMİTED,GÜNEŞLİ,KONAK,44,YOLCU TAŞIMA GRUBU,ACAT TAŞIMACILIK TURİZM OTOMOTİV İNŞAAT TAAHHÜT VE TİCARET  LİMİTED ŞİRKETİ,GÜNEŞLİ MAHALLESİ 526/2 SOKAK NO: 9 A KONAK / İZMİR
2262171,240384,LİMİTED,YAYLACIK,BUCA,44,YOLCU TAŞIMA GRUBU,ACEMA TURİZM TAŞIMACILIK İÇ VE DIŞ TİCARET LİMİTED ŞİRKETİ ,YAYLACIK MAHALLESİ 179 SK. NO: 6 İÇ KAPI NO: 4 BUCA / İZMİR
2005621,214567,LİMİTED,8 EYLÜL,KEMALPAŞA,44,YOLCU TAŞIMA GRUBU,ACN TAŞIMACILIK TURİZM SANAYİ VE TİCARET LİMİTED ŞİRKETİ ,8 EYLÜL MAHALLESİ 135 SK. OĞUZ Apt. NO: 16 B/1 KEMALPAŞA / İZMİR
2001841,214170,LİMİTED,ÇALIKUŞU,KARABAĞLAR,44,YOLCU TAŞIMA GRUBU,ADASLAN İLAÇLAMA TEMİZLİK İNSAN KAYNAKLARI VE TİCARET LİMİTED ŞİRKETİ,ÇALIKUŞU MAH. HALİDE EDİP ADIVAR CAD. MUSTABEY BLOK NO: 152/1A KARABAĞLAR / İZMİR
1243771,137524,LİMİTED,KARACAOĞLAN,BORNOVA,44,YOLCU TAŞIMA GRUBU,ADAYMUR TURİZM TAŞIMACILIK TEKSTİL MADENCİLİK PETROL OTOMOTİV İNŞAAT GIDA SANAYİ VE TİCARET LİMİTED ŞİRKETİ,KARACAOĞLAN MAHALLESİ 6253 SOKAK NO:8 DAİRE:16 BORNOVA / İZMİR
1068481,119256,LİMİTED,KEMALPAŞA,BORNOVA,44,YOLCU TAŞIMA GRUBU,ADBA TURİZM NAKLİYE PETROL İNŞAAT SANAYİ VE TİCARET LİMİTED ŞİRKETİ,KEMALPAŞA MAHALLESİ KEMALPAŞA CADDESİ BEYAZ EŞYA ÜRETİM BLOK NO: 320 BORNOVA / İZMİR
2189541,233073,LİMİTED,ATIFBEY,GAZİEMİR,44,YOLCU TAŞIMA GRUBU,ADBSHUTLLE TURİZM TAŞIMACILIK SANAYİ VE TİCARET LİMİTED ŞİRKETİ,ATIFBEY MAHALLESİ 2 SOKAK NO: 8A GAZİEMİR / İZMİR
2299265,249188,LİMİTED,KOZAĞAÇ,BUCA,44,YOLCU TAŞIMA GRUBU,ADEN GROUP TAŞIMACILIK TURİZM VE SEYAHAT ACENTASI TİCARET LİMİTED ŞİRKETİ,KOZAĞAÇ MAH. 220 SK. NO: 72 İÇ KAPI NO: 2 BUCA / İZMİR
1988421,212825,ANONİM,OSMANGAZİ,BAYRAKLI,44,YOLCU TAŞIMA GRUBU,ADM TAŞIMACILIK TURİZM SANAYİ VE TİCARET ANONİM ŞİRKETİ,OSMANGAZİ MAHALLESİ 592/6 SK. NO: 5/2 BAYRAKLI/İZMİR
2268961,241072,LİMİTED,8 EYLÜL,KEMALPAŞA,44,YOLCU TAŞIMA GRUBU,ADNAN BAYKAL TURİZM TAŞIMACILIK SANAYİ VE TİCARET LİMİTED ŞİRKETİ ,8 EYLÜL MAHALLESİ 74/1 SK NO:8 DAİRE:8 KEMALPAŞA / İZMİR
2291801,243390,LİMİTED,ATAŞEHİR,ÇİĞLİ,44,YOLCU TAŞIMA GRUBU,AEGEAN YAT İŞLETMECİLİĞİ SANAYİ VE TİCARET LİMİTED ŞİRKETİ,ATAŞEHİR MAHALLESİ ESKİ HAVAALANI CAD. NO:33 ALTAY BLOK ÇİĞLİ / İZMİR
2270911,241276,LİMİTED,MEHMET AKİF ERSOY,KEMALPAŞA,44,YOLCU TAŞIMA GRUBU,AG ARIN TURİZM TAŞIMACILIK SANAYİ VE TİCARET LİMİTED ŞİRKETİ,MEHMET AKİF ERSOY MAHALLESİ 234 SK. NO: 25A KEMALPAŞA / İZMİR
2193291,233443,LİMİTED,ARMUTLU 85.YIL CUMHURİYET,KEMALPAŞA,44,YOLCU TAŞIMA GRUBU,AGT KOÇ TAŞIMACILIK TURİZM OTOMOTİV GIDA İNŞAAT EMLAK TARIM HAYVANCILIK VE TİCARET LİMİTED ŞİRKETİ,ARMUTLU 85.YIL CUMHURİYET MAH. ARMUTLU İZMİR CAD. NO: 99B KEMALPAŞA / İZMİR
2296350,246264,LİMİTED,KAZIMDİRİK,BORNOVA,44,YOLCU TAŞIMA GRUBU,AĞAR NAKLİYAT TURİZM TAŞIMACILIK SANAYİ VE TİCARET LİMİTED ŞİRKETİ BORNOVA 1 ŞUBESİ,KAZIMDİRİK MAH. 351 SK. AFA İŞHANI NO: 7 İÇ KAPI NO: 107 BORNOVA / İZMİR
2059991,220031,LİMİTED,İSMET KAPTAN,KONAK,44,YOLCU TAŞIMA GRUBU,AĞUSTOS TAŞIMACILIK MAKİNA TURİZM İNŞAAT SANAYİ VE TİCARET  LİMİTED ŞİRKETİ,İSMET KAPTAN MAHALLESİ MAHALLESİ ŞAİR EŞREF BULVARI YÖRSAN İŞMERKEZİ Apt. NO: 26/42 KONAK / İZMİR
573401,7276,LİMİTED,ATAŞEHİR,ÇİĞLİ,44,YOLCU TAŞIMA GRUBU,AHMET ALTINTAŞ ÖZEL EĞİTİM TURİZM TAŞIMACILIK İNŞAAT OTOMOTİV KİTAP DAĞITIMI SANAYİ VE TİCARET LİMİTED ŞİRKETİ,ATAŞEHİR MAH. ANADOLU CAD. NO: 897 İÇ KAPI NO: 2 ÇİĞLİ / İZMİR
941141,104563,LİMİTED,KIZILAY,BORNOVA,44,YOLCU TAŞIMA GRUBU,AHMET UYSAL TURİZM MAKİNA OTOMOTİV VE YEDEK PARÇA NAKLİYAT VE PETROLCÜLÜK SANAYİ TİCARET LİMİTED ŞİRKETİ,KIZILAY MAHALLESİ 511 SOKAK NO:5/1 BORNOVA / İZMİR
1802881,194109,LİMİTED,SELVİLİ,KARABAĞLAR,44,YOLCU TAŞIMA GRUBU,AKARÇAY TAŞIMACILIK TURİZM OTOMOTİV İNŞAAT SANAYİ VE TİCARET LİMİTED ŞİRKETİ,SELVİLİ MAH. 4069 SK. NO: 5A KARABAĞLAR / İZMİR
2279131,242096,LİMİTED,YILDIZ,BUCA,44,YOLCU TAŞIMA GRUBU,AKBEY NAKLİYE TURİZM TAŞIMACILIK SANAYİ VE TİCARET LİMİTED ŞİRKETİ,YILDIZ MAH. 242/21 SK. NO: 2 BUCA / İZMİR
2190151,233102,LİMİTED,KARACAOĞLAN,BORNOVA,44,YOLCU TAŞIMA GRUBU,AKBULUT ORGANİZASYON DANIŞMANLIK DIŞ TİCARET TURİZM TAŞIMACILIK  SANAYİ VE TİCARET LİMİTED ŞİRKETİ OTOGAR ŞUBESİ,KARACAOĞLAN MAHALLESİ KEMALPAŞA CADDESI OTOGAR BLOK NO: 285 İÇ KAPI NO: Z033 BORNOVA / İZMİR
2301006,250929,LİMİTED,AKDENİZ,KONAK,44,YOLCU TAŞIMA GRUBU,AKBÜK SU ÜRÜNLERİ İNŞAAT TURİZM TAŞIMACILIK SANAYİ VE TİCARET LİMİTED ŞİRKETİ,AKDENİZ MAH. 1347 SK. ANBA İŞHANI NO: 8 İÇ KAPI NO: 305 KONAK / İZMİR
1435351,156188,LİMİTED,GÜNEŞLİ,KONAK,44,YOLCU TAŞIMA GRUBU,AKÇAKAYA TAŞIMACILIK HİZMETLERİ TURİZM İNŞAAT OTO ALIM SATIM OTO KİRALAMA SANAYİ VE TİCARET LİMİTED ŞİRKETİ,GÜNEŞLİ MAH. HALİDE EDİP ADIVAR CAD. NO: 75A İÇ KAPI NO: A KONAK / İZMİR
2165641,230644,LİMİTED,ADALET,BAYRAKLI,44,YOLCU TAŞIMA GRUBU,AKDEMİR SERVİS TAŞIMACILIK VE KANTİN İŞLETMECİLİĞİ GIDA İNŞAAT SANAYİ TİCARET LİMİTED ŞİRKETİ,ADALET MAH. 2131/12 SK. NO: 17A BAYRAKLI / İZMİR
2293814,243705,LİMİTED,TAHSİN YAZICI,KARABAĞLAR,44,YOLCU TAŞIMA GRUBU,AKSOYLU TAŞIMACILIK SANAYİ VE TİCARET LİMİTED ŞİRKETİ,TAHSİN YAZICI MAH. FATİN RÜŞTÜ ZORLU CAD. NO: 8 İÇ KAPI NO: 18 KARABAĞLAR / İZMİR
1536001,166230,LİMİTED,RAFETPAŞA,BORNOVA,44,YOLCU TAŞIMA GRUBU,AKSUN TURİZM TAŞIMACILIK YEDEK PARÇA SANAYİ VE TİCARET LİMİTED ŞİRKETİ ,RAFETPAŞA MAHALLESİ BURAK REIS CADDESI NO:157/A BORNOVA / İZMİR
2306846,256798,LİMİTED,BAHÇELİEVLER,KARŞIYAKA,44,YOLCU TAŞIMA GRUBU,AL TUR GROUP TAŞIMACILIK İNŞAAT TURİZM NAKLİYAT PETROL SANAYİ VE TİCARET LİMİTED ŞİRKETİ KARŞIYAKA ŞUBESİ,BAHÇELİEVLER MAH. CEVDET BİLSAY CAD. LEBLEBİCİOĞLU NO: 90B KARŞIYAKA / İZMİR
2305366,255314,LİMİTED,BEYAZEVLER,GAZİEMİR,44,YOLCU TAŞIMA GRUBU,ALABEYİ YAPI İNŞAAT OTOMOTİV TAŞIMACILIK VE SERVİS TİCARET LİMİTED ŞİRKETİ,BEYAZEVLER MAH. 544/1 SK. NO: 18/1 GAZİEMİR / İZMİR
1794641,193259,ANONİM,KARACAOĞLAN,BORNOVA,44,YOLCU TAŞIMA GRUBU,ALAŞEHİR SARIKIZ TAŞIMACILIK AKARYAKIT TURİZM OTOMOTİV İTHALAT  İHRACAT SANAYİ TİCARET ANONİM ŞİRKETİ İZMİR ŞUBESİ,KARACAOĞLAN MAHALLESİ KEMALPAŞA CAD. NO:285/Z033 BORNOVA / İZMİR
2001801,214178,ANONİM,İSMET KAPTAN,KONAK,44,YOLCU TAŞIMA GRUBU,ALBA KİRALAMA HİZMETLERİ ANONİM ŞİRKETİ,İSMET KAPTAN MAH. 1362 SK. BÜYÜK ÇAMLIBEL IS MERKEZI BLOK NO: 30 İÇ KAPI NO: 404 KONAK / İZMİR
2010581,215062,LİMİTED,CÜNEYTBEY,MENDERES,44,YOLCU TAŞIMA GRUBU,ALBERTA TURİZM TAŞIMACILIK VE TİCARET LİMİTED ŞİRKETİ,CÜNEYTBEY MAH. KUVA-İ MİLLİYE CAD. NO: 9-11 İÇ KAPI NO: 301 MENDERES / İZMİR
1920791,206015,LİMİTED,MANSUROĞLU,BAYRAKLI,44,YOLCU TAŞIMA GRUBU,ALC MOTORS GAYRİMENKUL İNŞAAT OTO KİRALAMA FİLO HİZMETLERİ TAAHHÜT İTHALAT İHRACAT SANAYİ VE TİCARET LİMİTED ŞİRKETİ İZMİR BAYRAKLI OTO,MANSUROĞLU MAHALLESİ 1593/1 SOK. NO:2/45 LIDER CENTRIO Apt. BAYRAKLI / İZMİR
1927211,206654,LİMİTED,ULAMIŞ,SEFERİHİSAR,44,YOLCU TAŞIMA GRUBU,ALEMDAR DENİZ İŞLETMELERİ VE TİCARET LİMİTED ŞİRKETİ,ULAMIŞ MAHALLESİ İZMİR CAD. ATA AMBALAJ SİT. NO: 201 SEFERİHİSAR/İZMİR
1705591,184382,LİMİTED,ALSANCAK,KONAK,44,YOLCU TAŞIMA GRUBU,ALFA KİRALAMA TURİZM TAŞIMACILIK PETROL İNŞAAT SANAYİ VE TİCARET LİMİTED ŞİRKETİ,ALSANCAK MAHALLESİ 1453 SOKAK NO:32 DAİRE:401 KONAK / İZMİR
2295286,245194,LİMİTED,ULUCAK MUSTAFA KEMAL ATATÜRK,KEMALPAŞA,44,YOLCU TAŞIMA GRUBU,ALİ ERİCEK TAŞIMACILIK GAYRİMENKUL TURİZM İNŞAAT TAAHHÜT TİCARET VE SANAYİ LİMİTED ŞİRKETİ,ULUCAK MUSTAFA KEMAL ATATÜRK MAH. MEHMET AKİF ERSOY CAD. NO: 59A KEMALPAŞA / İZMİR
1018291,113572,LİMİTED,ATATÜRK,BORNOVA,44,YOLCU TAŞIMA GRUBU,ALİ YENİDOĞAN TURİZM TAŞIMACILIK İNŞAAT GIDA HAYVANCILIK SANAYİ VE TİCARET LİMİTED ŞİRKETİ,ATATÜRK MAHALLESİ 896 SOKAK NO:4 DAİRE:5 BORNOVA/İZMİR
2211281,235252,LİMİTED,KEMALPAŞA OSB,KEMALPAŞA,44,YOLCU TAŞIMA GRUBU,ALİ YILMAZ TAŞIMACILIK LİMİTED ŞİRKETİ,KEMALPAŞA OSB MAH. GAZİ BUL. NO: 177 İÇ KAPI NO: 14 KEMALPAŞA / İZMİR
2296877,246799,LİMİTED,ULUCAK İSTİKLAL,KEMALPAŞA,44,YOLCU TAŞIMA GRUBU,ALİM SERVİS TAŞIMACILIK TİCARET LİMİTED ŞİRKETİ,ULUCAK İSTİKLAL MAH. 9228 SK. NO: 9 İÇ KAPI NO: 1 KEMALPAŞA / İZMİR
2045001,218517,LİMİTED,FIRAT,BUCA,44,YOLCU TAŞIMA GRUBU,ALP KARDEŞLER TURİZM TAŞIMACILIK SANAYİ VE TİCARET LİMİTED ŞİRKETİ ,FIRAT MAHALLESİ 288/33 SK. NO:1/3 BUCA / İZMİR
2160701,230146,LİMİTED,ATIFBEY,GAZİEMİR,44,YOLCU TAŞIMA GRUBU,ALPER VİP TURİZM TAŞIMACILIK GIDA İNŞAAT E-TİCARET EMLAK TİCARET LİMİTED ŞİRKETİ,ATIFBEY MAHALLESİ 5 SOK. NO: 33 İÇ KAPI NO: 302 GAZİEMİR / İZMİR
2059291,219952,LİMİTED,YILDIZ,BUCA,44,YOLCU TAŞIMA GRUBU,ALR TAŞIMACILIK TURİZM SANAYİ VE TİCARET LİMİTED ŞİRKETİ,YILDIZ MAHALLESİ 242/12 SK. NO:17/A BUCA / İZMİR
2301200,251130,LİMİTED,ADALET,BAYRAKLI,44,YOLCU TAŞIMA GRUBU,ALTARES TURİZM TAŞIMACILIK GIDA SANAYİ VE TİCARET LİMİTED ŞİRKETİ,ADALET MAH. ANADOLU CAD. MEGAPOL TOWER NO: 41 İÇ KAPI NO: 101 BAYRAKLI / İZMİR
2206971,234816,LİMİTED,DAMLACIK,KEMALPAŞA,44,YOLCU TAŞIMA GRUBU,ALY TAŞIMACILIK VE ELEKTRİK MALZEMELERİ TİCARET SANAYİ LİMİTED  ŞİRKETİ,DAMLACIK MAHALLESİ NO:12 9517 SK Ç KAPI NO: 1 KIROVASI MEVKİİ KEMALPAŞA / İZMİR
1810881,194929,ANONİM,KARACAOĞLAN,NO:285/1B004,44,YOLCU TAŞIMA GRUBU,ANADOLU BİLET SATIŞ VE OTOBÜS İŞLETMECİLİĞİ ANONİM ŞİRKETİ- İZMİR ŞUBESİ,KARACAOĞLAN MAHALLESİ KEMALPAŞA CAD. NO:285/1B004 / İZMİR
1818541,195699,LİMİTED,AYDINLIKEVLER,ÇİĞLİ,44,YOLCU TAŞIMA GRUBU,ANIK TAŞIMACILIK TURİZM OTOMOTİV İNŞAAT SAĞLIK HİZMETLERİ SANAYİ  VE TİCARET LİMİTED ŞİRKETİ,AYDINLIKEVLER MAHALLESİ 6783 SK. NO:46/1 ÇİĞLİ / İZMİR
1605091,174382,LİMİTED,MERSİNLİ,KONAK,44,YOLCU TAŞIMA GRUBU,ANITKAYA TURİZM TAŞIMACILIK VE OTOMOTİV SANAYİ TİCARET LİMİTED ŞİRKETİ,MERSİNLİ MAHALLESİ 2823 SOK. NO:67/31 KONAK / İZMİR
1628701,176762,LİMİTED,BAHRİYE ÜÇOK,KARŞIYAKA,44,YOLCU TAŞIMA GRUBU,ANKATUR TURİZM TAŞIMACILIK GIDA SANAYİ VE TİCARET LİMİTED ŞİRKETİ ,BAHRİYE ÜÇOK MAHALLESİ RÜŞTÜ ŞARDAĞ CADDESİ NO:83/8 KARŞIYAKA / İZMİR
2182201,232320,LİMİTED,ULUCAK İSTİKLAL,KEMALPAŞA,44,YOLCU TAŞIMA GRUBU,ANLAS TURİZM TAŞIMACILIK OTOMOTİV İNŞAAT SANAYİ VE TİCARET LİMİTED ŞİRKETİ,ULUCAK İSTİKLAL MAH. TURGUT ÖZAL BUL. NO: 19/C İÇ KAPI NO: 1 KEMALPAŞA / İZMİR
2281271,242316,LİMİTED,KARACAOĞLAN,BORNOVA,44,YOLCU TAŞIMA GRUBU,ANSIZIN TURİZM YAPI SANAYİ VE TİCARET LİMİTED ŞİRKETİ,KARACAOĞLAN MAHALLESİ KEMALPAŞA CADDESI NO:285 OTOGAR BLOK İÇ KAPI NO: Z068 BORNOVA / İZMİR
413461,3638,LİMİTED,ZÜBEYDEHANIM,KARŞIYAKA,44,YOLCU TAŞIMA GRUBU,ARABACIOĞLU ORGANİZASYON TURİZM NAKLİYE TİCARET LİMİTED ŞİRKETİ ,ZÜBEYDEHANIM MAHALLESİ 7449/1 SK. NO:5/3 KARŞIYAKA / İZMİR
2302915,252851,LİMİTED,TEKELİ ATATÜRK,MENDERES,44,YOLCU TAŞIMA GRUBU,ARAF SERVİS TAŞIMACILIĞI TURİZM İNŞAAT SANAYİ VE TİCARET LİMİTED ŞİRKETİ,TEKELİ ATATÜRK MAH. DUMLUPINAR SK. NO: 9 MENDERES / İZMİR
2035501,217568,LİMİTED,BAĞYURDU YENİ,KEMALPAŞA,44,YOLCU TAŞIMA GRUBU,ARAS DEPOCULUK LOJİSTİK OTOMOTİV TURİZM İNŞAAT SANAYİ VE TİCARET LİMİTED ŞİRKETİ,BAĞYURDU YENİ MAH. SARI CEVİZ KÜME EVLERİ NO: 36 KEMALPAŞA / İZMİR
1230631,136128,LİMİTED,YENİGÜN,BUCA,44,YOLCU TAŞIMA GRUBU,"ARCANAZ TURİZM TAŞIMACILIK OTOMOTİV, OTO KİRALAMA, GIDA TİCARET LİMİTED ŞİRKETİ",YENİGÜN MAHALLESİ 268 SK. NO:42/A BUCA/İZMİR
1829721,196828,LİMİTED,ÇELEBİ,GÜZELBAHÇE,44,YOLCU TAŞIMA GRUBU,ARDA GÜVEN TURİZM TAŞIMACILIK GIDA İNŞAAT SANAYİ TİCARET LİMİTED ŞİRKETİ,ÇELEBİ MAHALLESİ ESKİ SEFERİHİSAR CAD. NO:4 GÜZELBAHÇE / İZMİR
2303920,253855,LİMİTED,ADALET,BAYRAKLI,44,YOLCU TAŞIMA GRUBU,ARDAM ÖZEL EĞİTİM TURİZM TAŞIMACILIK İNŞAAT SANAYİ VE TİCARET LİMİTED ŞİRKETİ,ADALET MAH. ANADOLU CAD. MEGAPOL TOWER NO: 41 İÇ KAPI NO: 081 BAYRAKLI / İZMİR
2304455,254399,LİMİTED,OSMANGAZİ,BAYRAKLI,44,YOLCU TAŞIMA GRUBU,ARGE TAŞIMACILIK TURİZM TİCARET LİMİTED ŞİRKETİ,OSMANGAZİ MAH. OSMANGAZİ CAD. NO: 84B BAYRAKLI / İZMİR
2043091,218318,LİMİTED,BAYRAKLI,BAYRAKLI,44,YOLCU TAŞIMA GRUBU,ARGEMONİA TURİZM ENERJİ TAŞIMACILIK İNŞAAT İHRACAT İTHALAT LİMİTED ŞİRKETİ,BAYRAKLI MAH. ANADOLU CAD. NO: 51B BAYRAKLI / İZMİR
2149101,228983,LİMİTED,YELKİ,GÜZELBAHÇE,44,YOLCU TAŞIMA GRUBU,ARINTUR TAŞIMACILIK TURİZM SANAYİ VE TİCARET LİMİTED ŞİRKETİ,YELKİ MAH. 2505 SK. NO: 1 İÇ KAPI NO: 6 GÜZELBAHÇE / İZMİR
1872881,201190,ANONİM,ÇINARLI,KONAK,44,YOLCU TAŞIMA GRUBU,ARKASAİR HAVACILIK VE TİCARET ANONİM ŞİRKETİ MİSTRAL ŞUBESİ ,ÇINARLI MAHALLESİ ANKARA ASFALTI CADDESİ NO:15/141 KONAK / İZMİR
1470401,159678,LİMİTED,CUMHURİYET,KARŞIYAKA,44,YOLCU TAŞIMA GRUBU,ARŞİPEL TAŞIMACILIK HAYVANCILIK TURİZM İNŞAAT SANAYİ VE TİCARET LİMİTED ŞİRKETİ,CUMHURİYET MAHALLESİ 6706 SK. NO:14 KARŞIYAKA / İZMİR
2304902,254850,LİMİTED,GÜMÜŞPALA,BAYRAKLI,44,YOLCU TAŞIMA GRUBU,ARYA TEKNE VE YAT KİRALAMA ALIM SATIM TURİZM SEYAHAT ACENTE VE DIŞ TİCARET LİMİTED ŞİRKETİ,GÜMÜŞPALA MAH. 7000 SK. NO: 116 İÇ KAPI NO: 11 BAYRAKLI / İZMİR
2044631,218486,ANONİM,KARACAOĞLAN,BORNOVA,44,YOLCU TAŞIMA GRUBU,AS ADANA SEYAHAT TURİZM AKARYAKIT İNŞAAT GIDA TEKSTİL VE SANAYİ TİCARET ANONİM ŞİRKETİ İZMİR OTOGAR ŞUBESİ,KARACAOĞLAN MAHALLESİ KEMALPAŞA CAD. OTOGAR APT. NO: 285/Z068 BORNOVA/İZMİR
2170231,231111,LİMİTED,ADALET,BAYRAKLI,44,YOLCU TAŞIMA GRUBU,ASEFE TAŞIMACILIK SERVİS İŞLETMECİLİĞİ TURİZM İNŞAAT GIDA SANAYİ VE TİCARET LİMİTED ŞİRKETİ,ADALET MAH. 1586/7 SK. B BLOK NO: 4 İÇ KAPI NO: 12 BAYRAKLI / İZMİR
2294470,244375,LİMİTED,ALSANCAK,KONAK,44,YOLCU TAŞIMA GRUBU,ASGARD YATÇILIK VE TURİZM LİMİTED ŞİRKETİ,ALSANCAK MAH. TALATPAŞA BUL. DOSTLAR BLOK NO: 55 İÇ KAPI NO: 1 KONAK / İZMİR
1691631,183040,LİMİTED,FEVZİ ÇAKMAK,BALÇOVA,44,YOLCU TAŞIMA GRUBU,ASM ORGANİZASYON HİZMET TAŞIMACILIK GIDA SU ÜRÜNLERİ SANAYİ TİCARET LİMİTED ŞİRKETİ,FEVZİ ÇAKMAK MAH. MİNE SK. HALE BLOK NO: 30 İÇ KAPI NO: 1 BALÇOVA / İZMİR
2100011,224061,LİMİTED,KARACAOĞLAN,BORNOVA,44,YOLCU TAŞIMA GRUBU,ASYA TUR SEYAHAT TAŞIMACILIK LİMİTED ŞİRKETİ İZMİR OTOGAR ŞUBESİ,KARACAOĞLAN MAHALLESİ KEMALPAŞA CAD. NO:285/Z045 OTOGAR BLOK BORNOVA / İZMİR
1181871,131264,LİMİTED,İSTİKLAL,KEMALPAŞA,44,YOLCU TAŞIMA GRUBU,AŞKIN ÇELEBİ TURİZM SERVİS TAŞIMACILIK NAKLİYE OTO VE PETROL ÜRÜNLERİ İNŞAAT TARIM TİCARET LİMİTED ŞİRKETİ,İSTİKLAL MAHALLESİ NO:22/2 ULUCAK KEMALPAŞA / İZMİR
2178341,231930,LİMİTED,KARAÇAM,BORNOVA,44,YOLCU TAŞIMA GRUBU,ATA BEY GRUP LOJİSTİK FİLO DIŞ TİCARET LİMİTED ŞİRKETİ,KARAÇAM MAH. İSTANBUL CAD. NO: 120A BORNOVA / İZMİR
2291761,243393,LİMİTED,ADALET,BAYRAKLI,44,YOLCU TAŞIMA GRUBU,ATABAY TUR TURİZM SEYAHAT TAŞIMACILIK İNŞAAT SANAYİ VE TİCARET LİMİTED ŞİRKETİ,ADALET MAHALLESİ MANAS BULV. NO:39 İÇ KAPI NO: 3804 BAYRAKLI / İZMİR
2205561,234660,LİMİTED,KARACAOĞLAN,BORNOVA,44,YOLCU TAŞIMA GRUBU,ATABAYLAR TURİZM SANAYİ VE TİCARET LİMİTED ŞİRKETİ İZMİR BORNOVA  ŞUBESİ,KARACAOĞLAN MAHALLESİ KEMALPAŞA CADDESI OTOGAR BLOK NO: 285 İÇ KAPI NO: Z082 BORNOVA / İZMİR
1674431,181320,LİMİTED,BAYRAKLI,BAYRAKLI,44,YOLCU TAŞIMA GRUBU,ATADEN İNŞAAT TAŞIMACILIK MİMARLIK MÜHENDİSLİK SANAYİ VE TİCARET LİMİTED ŞİRKETİ,BAYRAKLI MAHALLESİ ANADOLU CAD. NO:161/10 BAYRAKLI / İZMİR
1594711,173331,LİMİTED,YEŞİLOVA,BORNOVA,44,YOLCU TAŞIMA GRUBU,ATALAR TAŞIMACILIK TURİZM OTO KİRALAMA ORGANİZASYON HİZMETLERİ SANAYİ VE TİCARET LİMİTED ŞİRKETİ,YEŞİLOVA MAH. 4176 SK. NO:15 BORNOVA/İZMİR
1458611,158488,LİMİTED,BEYAZEVLER,GAZİEMİR,44,YOLCU TAŞIMA GRUBU,ATLILAR PETROL VE PETROL ÜRÜNLERİ HARFİYAT NAKLİYAT GIDA TURİZM İNŞAAT SANAYİ VE TİCARET LİMİTED ŞİRKETİ,BEYAZEVLER MAH. 556 SK. NO: 41C GAZİEMİR / İZMİR
1674751,181358,LİMİTED,KARACAOĞLAN,BORNOVA,44,YOLCU TAŞIMA GRUBU,ATS AST SÜRÜCÜ SHOW TURİZM OTOMOTİV TAŞIMACILIK İNŞAAT SANAYİ VE TİCARET LİMİTED ŞİRKETİ,KARACAOĞLAN MAHALLESİ KEMALPAŞA CAD. NO:285/Z083 BORNOVA / İZMİR
2298311,248228,LİMİTED,ULUCAK MUSTAFA KEMAL ATATÜRK,KEMALPAŞA,44,YOLCU TAŞIMA GRUBU,AYÇEL TURİZM TAŞIMACILIK SANAYİ VE TİCARET LİMİTED ŞİRKETİ,ULUCAK MUSTAFA KEMAL ATATÜRK MAH. 9192 SK. 3 NO: 13 İÇ KAPI NO: 4 KEMALPAŞA / İZMİR
2219901,236122,LİMİTED,ULUCAK MUSTAFA KEMAL ATATÜRK,KEMALPAŞA,44,YOLCU TAŞIMA GRUBU,AYES PROFİL LOJİSTİK SANAYİ VE TİCARET LİMİTED ŞİRKETİ,ULUCAK MUSTAFA KEMAL ATATÜRK MAH. 9221 SK. NO: 9 İÇ KAPI NO: 2 KEMALPAŞA / İZMİR
679401,81757,LİMİTED,FUAT EDİP BAKSI,BAYRAKLI,44,YOLCU TAŞIMA GRUBU,AYHAN KAYACAN TURİZM TAŞIMACILIK OTOMOTİV TİCARET VE SANAYİ LİMİTED ŞİRKETİ,FUAT EDİP BAKSI MAH. 1629 SK. NO: 33A BAYRAKLI / İZMİR
1475451,160176,LİMİTED,YALI,ÇEŞME,44,YOLCU TAŞIMA GRUBU,AY-MÜ TURİZM TAŞIMACILIK İNŞAAT EMLAK OTO İTHALAT İHRACAT SANAYİ VE TİCARET LİMİTED ŞİRKETİ,YALI MAHALLESİ 6297 SK. NO:12 ÇEŞME / İZMİR
1826661,196511,LİMİTED,KAZIM DİRİK,BORNOVA,44,YOLCU TAŞIMA GRUBU,AYTUR VİP TAŞIMACILIK KİRALAMA TURİZM İNŞAAT TAAHHÜT İTHALAT  İHRACAT SANAYİ VE TİCARET LİMİTED ŞİRKETİ İZMİR BORNOVA ŞUBESİ,KAZIM DİRİK MAHALLESİ ÜNİVERSİTE CD. NO: 40 B BORNOVA / İZMİR
2304592,254541,LİMİTED,ALİ FUAT CEBESOY,KARABAĞLAR,44,YOLCU TAŞIMA GRUBU,BABA OĞUL TAŞIMACILIK TURİZM İNŞAAT LİMİTED ŞİRKETİ,ALİ FUAT CEBESOY MAH. 9125/6 SK. NO: 48 İÇ KAPI NO: 1 KARABAĞLAR / İZMİR
1979331,211920,LİMİTED,29 EKİM,KEMALPAŞA,44,YOLCU TAŞIMA GRUBU,BAĞYURDU TAŞIMACILIK TURİZM GIDA TARIM HAYVANCILIK ORMAN ÜRÜNLERİ  TEMİZLİK SANAYİ VE TİCARET LİMİTED ŞİRKETİ BAĞYURDU ŞUBESİ,29 EKİM MAHALLESİ TURGUTLU CAD. NO:49 KEMALPAŞA / İZMİR
2131261,227195,LİMİTED,ÇAMTEPE,NARLIDERE,44,YOLCU TAŞIMA GRUBU,BAHTİYAR TAŞIMACILIK OTOMOTİV TİCARET LİMİTED ŞİRKETİ,ÇAMTEPE MAH. ÇAYIRLI SK. ASLAN BLOK NO: 8A NARLIDERE / İZMİR
612741,94359,ANONİM,AOSB,ÇİĞLİ,44,YOLCU TAŞIMA GRUBU,BAKNET BİLGİ İŞLEM VE TAŞIMACILIK TİCARET ANONİM ŞİRKETİ,AOSB MAH. 10000 SK. NO: 5 İÇ KAPI NO: 1 ÇİĞLİ / İZMİR
2000081,214006,ANONİM,YILDIZLAR,BUCA,44,YOLCU TAŞIMA GRUBU,BAKNET BİLGİ İŞLEM VE TAŞIMACILIK TİCARET ANONİM ŞİRKETİ HAVA ARACI KİRALAMA HİZMETLERİ ŞUBESİ,YILDIZLAR MAHALLESİ ŞEHİT ER ZEKİ TOKER CAD. NO: 28 BUCA/İZMİR
1178601,131073,LİMİTED,BAYRAKLI,BAYRAKLI,44,YOLCU TAŞIMA GRUBU,BALKES TAŞIMACILIK TURİZM PETROL SANAYİ VE TİCARET LİMİTED ŞİRKETİ,BAYRAKLI MAH. 1921 SK. UMUT 2 NO: 11A BAYRAKLI / İZMİR
2266681,240838,LİMİTED,ÇİÇEK,BAYRAKLI,44,YOLCU TAŞIMA GRUBU,BALL TURİZM TAŞIMACILIK OTOMOTİV SANAYİ VE TİCARET LİMİTED ŞİRKETİ ,ÇİÇEK MAHALLESİ 1610 SOK. NO:219 DAİRE:4 BAYRAKLI / İZMİR
2197681,233873,LİMİTED,VALİ RAHMİ BEY,BUCA,44,YOLCU TAŞIMA GRUBU,BARANTUR TURİZM SANAYİ VE TİCARET LİMİTED ŞİRKETİ ,VALİ RAHMİ BEY MAHALLESİ ÖZMEN CADDESI NO:88 İŞHANI BLOK İÇ KAPI NO: 306 BUCA BUCA / İZMİR
1433381,155996,LİMİTED,GAZİ,GAZİEMİR,44,YOLCU TAŞIMA GRUBU,BARIŞ KAYA TURİZM SEYAHAT TAŞIMACILIK İNŞAAT GIDA SANAYİ VE TİCARET LİMİTED ŞİRKETİ,GAZİ MAHALLESİ 15 SK. NO: 12/4 GAZİEMİR/İZMİR
1694811,183365,ANONİM,MUSTAFA KEMAL,BUCA,44,YOLCU TAŞIMA GRUBU,BATI TRANSFER SANAYİ VE TİCARET ANONİM ŞİRKETİ ,MUSTAFA KEMAL MAHALLESİ 686/35 SK. NO: 1A İÇ KAPI NO: A BUCA / İZMİR
2285571,242754,LİMİTED,KAZIM KARABEKİR,KARABAĞLAR,44,YOLCU TAŞIMA GRUBU,BATIYOL TURİZM TAŞIMACILIK TEKSTİL GIDA İNŞAAT SANAYİ VE TİCARET  LİMİTED ŞİRKETİ,KAZIM KARABEKİR MAH. MAHALLESİ 9002/10 SK. NO: 8 İÇ KAPI NO: 11 KARABAĞLAR / İZMİR
712141,9330,LİMİTED,BAHÇELİEVLER,KARŞIYAKA,44,YOLCU TAŞIMA GRUBU,BATUHAN TORNACILIK MAKİNA VE TURİZM İÇ DIŞ TİCARET VE SANAYİ LİMİTED ŞİRKETİ,BAHÇELİEVLER MAHALLESİ YAŞAR AKSOY SK. NO: 107/2 KARŞIYAKA/İZMİR
2068291,220866,LİMİTED,GÜNEŞLİ,KONAK,44,YOLCU TAŞIMA GRUBU,BAY BORA TURİZM TAŞIMACILIK TİCARET VE SANAYİ LİMİTED ŞİRKETİ ,GÜNEŞLİ MAHALLESİ 529/1 SOK. NO:26/2 MUKYEN Apt. KONAK / İZMİR
2067481,220764,LİMİTED,HÜRRİYET,GAZİEMİR,44,YOLCU TAŞIMA GRUBU,BAYKAR TAŞIMACILIK TURİZM OTO KİRALAMA GIDA İNŞAAT SANAYİ VE TİCARET LİMİTED ŞİRKETİ,HÜRRİYET MAHALLESİ 1054 SOKAK NO:34/3 GAZİEMİR / İZMİR
1972991,211286,LİMİTED,YENİ MAHALLE,ÇİĞLİ,44,YOLCU TAŞIMA GRUBU,BCLTUR TAŞIMACILIK İNŞAAT OTOMOTİV TURİZM GIDA TEKSTİL İÇ VE DIŞ TİCARET LİMİTED ŞİRKETİ,YENİ MAHALLE MAHALLESİ ESKİ HAVAALANI CAD. AYDIN APT. NO: 72/4 ÇİĞLİ/İZMİR
1900041,203933,LİMİTED,MERSİNLİ,KONAK,44,YOLCU TAŞIMA GRUBU,BEDRİ TOROS TAŞIMACILIK TURİZM SANAYİ VE TİCARET LİMİTED ŞİRKETİ,MERSİNLİ MAHALLESİ 2836 SK. NO: 31/301 KONAK/İZMİR
1473381,159984,LİMİTED,ÜMİT,BORNOVA,44,YOLCU TAŞIMA GRUBU,BENGÜ TAŞIMACILIK TURİZM İNŞAAT GIDA TEMİZLİK SANAYİ VE TİCARET LİMİTED ŞİRKETİ,ÜMİT MAHALLESİ 7326 SK. NO:8/3 PINARBAŞI BORNOVA / İZMİR
2304955,254899,LİMİTED,GÖKSU,BUCA,44,YOLCU TAŞIMA GRUBU,BEŞERİ TURİZM SERVİS TAŞIMACILIĞI SANAYİ VE TİCARET LİMİTED ŞİRKETİ,GÖKSU MAH. 637/38 SK. NO: 43 İÇ KAPI NO: 2 BUCA / İZMİR
1462681,158901,LİMİTED,DEMİRKÖPRÜ,KARŞIYAKA,44,YOLCU TAŞIMA GRUBU,BEYOĞLU ARAÇ KİRALAMA DANIŞMANLIK TURİZM TAŞIMACILIK GIDA VE DAYANIKLI TÜKETİM MALLARI SANAYİ VE TİCARET LİMİTED ŞİRKETİ,DEMİRKÖPRÜ MAH. 6170 SK. NO: 4 İÇ KAPI NO: 10 KARŞIYAKA / İZMİR
1302761,143465,LİMİTED,YENİ,ÇİĞLİ,44,YOLCU TAŞIMA GRUBU,BEZEK TURİZM TEMİZLİK TAŞIMACILIK SANAYİ TİCARET LİMİTED ŞİRKETİ ,YENİ MAHALLESİ 8200 SOKAK NO:7/1 KAT:1 DAİRE:1 ÇİĞLİ / İZMİR
2105281,224595,LİMİTED,MEHMET AKİF ERSOY,KEMALPAŞA,44,YOLCU TAŞIMA GRUBU,BG GRUP TURİZM TİCARET LİMİTED ŞİRKETİ,MEHMET AKİF ERSOY MAH. ATATÜRK BUL. NO: 43 İÇ KAPI NO: 9 KEMALPAŞA / İZMİR
2298786,248698,LİMİTED,YENİ MAHALLE,ÇİĞLİ,44,YOLCU TAŞIMA GRUBU,BİCİL TURİZM TAŞIMACILIK OTOMOTİV İNŞAAT SANAYİ İÇ VE DIŞ TİCARET LİMİTED ŞİRKETİ,YENİ MAHALLE MAH. ESKİ HAVAALANI CAD. NO: 72 İÇ KAPI NO: 4 ÇİĞLİ / İZMİR
1934221,207360,LİMİTED,8 EYLÜL,KEMALPAŞA,44,YOLCU TAŞIMA GRUBU,BİDA TAŞIMACILIK İNŞAAT KLİMA SANAYİ TİCARET LİMİTED ŞİRKETİ ,8 EYLÜL MAHALLESİ 121 SK. NO: 1 A/1 KEMALPAŞA / İZMİR
2028321,216848,LİMİTED,ÇINARLI,KONAK,44,YOLCU TAŞIMA GRUBU,BİEKSPER OTOMOTİV TURİZM SANAYİ VE TİCARET LİMİTED ŞİRKETİ,ÇINARLI MAH. OZAN ABAY CAD. EGEPERLA NO: 8 İÇ KAPI NO: Z27 KONAK / İZMİR
2028991,216904,LİMİTED,ALSANCAK,KONAK,44,YOLCU TAŞIMA GRUBU,BİLTRANS LOJİSTİK SANAYİ VE TİCARET LİMİTED ŞİRKETİ ,ALSANCAK MAHALLESİ KIBRIS ŞEHİTLER CAD. NO:185/203 AKSOY Apt. KONAK / İZMİR
2265541,240727,LİMİTED,İSMET KAPTAN,KONAK,44,YOLCU TAŞIMA GRUBU,BİNBİR YAPIMCILIK TAŞIMACILIK ORGANİZASYON TİCARET LİMİTED ŞİRKETİ,İSMET KAPTAN MAHALLESİ 1368 SOKAK HOTEL LALELİ BLOK NO: 7A KONAK / İZMİR
611971,100431,LİMİTED,ATAŞEHİR,ÇİĞLİ,44,YOLCU TAŞIMA GRUBU,BİNSEL TURİZM TAŞIMACILIK VE İNŞAAT SANAYİ VE TİCARET LİMİTED ŞİRKETİ,ATAŞEHİR MAHALLESİ 8001/3 SOKAK A-BLOK NO: 7 İÇ KAPI NO: 1 ÇİĞLİ / İZMİR
1190291,131971,LİMİTED,CUMHURİYET,NO:59,44,YOLCU TAŞIMA GRUBU,BİROL ÖNAL TURİZM SERVİS TAŞIMACILIK NAKLİYE OTO VE PETROL ÜRÜNLERİ İNŞAAT TARIM TİCARET LİMİTED ŞİRKETİ,CUMHURİYET MAH. MAHALLESİ ULUCAK İZMİR CAD. NO:59/2 KEMALPAŞA
489421,126213,LİMİTED,BAYRAKLI,BAYRAKLI,44,YOLCU TAŞIMA GRUBU,BİZİM MURAT TURİZM VE TAŞIMACILIK SANAYİ VE TİCARET LİMİTED ŞİRKETİ,BAYRAKLI MAH. ANADOLU CAD. NO: 51A BAYRAKLI / İZMİR
2239661,238118,LİMİTED,GÖKDERE,BORNOVA,44,YOLCU TAŞIMA GRUBU,BLACK SEA CHARTER TAŞIMACILIK DENİZCİLİK TURİZM TİCARET LİMİTED ŞİRKETİ,GÖKDERE MAH. GÖKDERE CAD. NO: 44D BORNOVA / İZMİR
2141961,228269,ANONİM,ERZENE,BORNOVA,44,YOLCU TAŞIMA GRUBU,BLU TURİZM SEYAHAT GIDA TİCARET ANONİM ŞİRKETİ,ERZENE MAH. 6 SK. EMİNE HATUN BLOK NO: 6A BORNOVA / İZMİR
1979571,211931,LİMİTED,ALSANCAK,KONAK,44,YOLCU TAŞIMA GRUBU,BLUE MOUNTAIN MARİNE İŞLETMECİLİĞİ LİMİTED ŞİRKETİ ,ALSANCAK MAHALLESİ 1456 SOKAK NO:83/11 KONAK / İZMİR
2297467,247386,LİMİTED,ATIFBEY,GAZİEMİR,44,YOLCU TAŞIMA GRUBU,BLUEGE TURİZM TAŞIMACILIK HİZMET VE TİCARET LİMİTED ŞİRKETİ,ATIFBEY MAH. LOZAN CAD. NO: 5A İÇ KAPI NO: A GAZİEMİR / İZMİR
2297031,246938,LİMİTED,KARABAĞLAR,KARABAĞLAR,44,YOLCU TAŞIMA GRUBU,BLUR TURİZM SEYAHAT GIDA TİCARET LİMİTED ŞİRKETİ,KARABAĞLAR MAH. 5758 SK. NO: 17-21 İÇ KAPI NO: 212 KARABAĞLAR / İZMİR
